,id,conversation_id,created_at,date,timezone,place,tweet,language,hashtags,cashtags,user_id,user_id_str,username,name,day,hour,link,urls,photos,video,thumbnail,retweet,nlikes,nreplies,nretweets,quote_url,search,near,geo,source,user_rt_id,user_rt,retweet_id,reply_to,retweet_date,translate,trans_src,trans_dest
0,1599891461717491712,1599891461717491712,1670278823000.0,2022-12-06 03:50:23,+0530,,“We rekt”,nl,[],[],942999039192186882,942999039192186882,AltcoinPsycho,Psycho,2,03,https://twitter.com/AltcoinPsycho/status/1599891461717491712,[],[],0,,False,62,9,3,https://twitter.com/deitaone/status/1599876508742475777,None,,,,,,,[],,,,
1,1599670670983860227,1599666952686866432,1670226183000.0,2022-12-05 13:13:03,+0530,,"@TeddyCleps 3 star life eh, enjoy man that’s a special one",en,[],[],942999039192186882,942999039192186882,AltcoinPsycho,Psycho,1,13,https://twitter.com/AltcoinPsycho/status/1599670670983860227,[],[],0,,False,18,2,0,,None,,,,,,,"[{'screen_name': 'TeddyCleps', 'name': 'Teddy', 'id': '905778654503940096'}]",,,,
2,1599634256879550465,1599457816494092289,1670217501000.0,2022-12-05 10:48:21,+0530,,@sama No safeguards. AI shouldn’t be co-mingled with politics,en,[],[],942999039192186882,942999039192186882,AltcoinPsycho,Psycho,1,10,https://twitter.com/AltcoinPsycho/status/1599634256879550465,[],[],0,,False,185,9,6,,None,,,,,,,"[{'screen_name': 'sama', 'name': 'Sam Altman', 'id': '1605'}]",,,,
3,1599592346903281664,1599592346903281664,1670207509000.0,2022-12-05 08:01:49,+0530,,📸,art,[],[],942999039192186882,942999039192186882,AltcoinPsycho,Psycho,1,08,https://twitter.com/AltcoinPsycho/status/1599592346903281664,[],[],0,,False,126,13,4,https://twitter.com/sbf_ftx/status/1376252680574656513,None,,,,,,,[],,,,
4,1599534873043406848,1599533775267848193,1670193806000.0,2022-12-05 04:13:26,+0530,,@EvgenyGaevoy Chatgpt?😂,en,[],[],942999039192186882,942999039192186882,AltcoinPsycho,Psycho,1,04,https://twitter.com/AltcoinPsycho/status/1599534873043406848,[],[],0,,False,5,1,0,,None,,,,,,,"[{'screen_name': 'EvgenyGaevoy', 'name': 'wishful cynic', 'id': '880405027130617857'}]",,,,
5,1599477736921530369,1599477736921530369,1670180183000.0,2022-12-05 00:26:23,+0530,,I think the bottom is close but then I see tweets like this,en,[],[],942999039192186882,942999039192186882,AltcoinPsycho,Psycho,1,00,https://twitter.com/AltcoinPsycho/status/1599477736921530369,[],[],0,,False,287,43,8,https://twitter.com/liathetrader/status/1598729791674486790,None,,,,,,,[],,,,
6,1599306317357019137,1599306155704000513,1670139314000.0,2022-12-04 13:05:14,+0530,,@conzimp thats bc you guys aren't bumping metro's new album,en,[],[],942999039192186882,942999039192186882,AltcoinPsycho,Psycho,7,13,https://twitter.com/AltcoinPsycho/status/1599306317357019137,[],[],0,,False,30,9,0,,None,,,,,,,"[{'screen_name': 'conzimp', 'name': 'Ansem🦋', 'id': '1288929150628175874'}]",,,,
7,1599227527377358848,1599219855806582784,1670120529000.0,2022-12-04 07:52:09,+0530,,@TheCryptoDog So true king,en,[],[],942999039192186882,942999039192186882,AltcoinPsycho,Psycho,7,07,https://twitter.com/AltcoinPsycho/status/1599227527377358848,[],[],0,,False,99,5,0,,None,,,,,,,"[{'screen_name': 'TheCryptoDog', 'name': 'The Crypto Dog🫐', 'id': '887748030304329728'}]",,,,
8,1599189421412470784,1599073451209240576,1670111444000.0,2022-12-04 05:20:44,+0530,,@Pentosh1 Lekker bezig vriend,nl,[],[],942999039192186882,942999039192186882,AltcoinPsycho,Psycho,7,05,https://twitter.com/AltcoinPsycho/status/1599189421412470784,[],[],0,,False,50,14,0,,None,,,,,,,"[{'screen_name': 'Pentosh1', 'name': 'Pentoshi 🐧', 'id': '1138993163706753029'}]",,,,
9,1598799165349584898,1598797443528892428,1670018399000.0,2022-12-03 03:29:59,+0530,,@CryptoKaleo Good stuff,en,[],[],942999039192186882,942999039192186882,AltcoinPsycho,Psycho,6,03,https://twitter.com/AltcoinPsycho/status/1598799165349584898,[],[],0,,False,36,3,0,,None,,,,,,,"[{'screen_name': 'CryptoKaleo', 'name': 'K A L E O', 'id': '906234475604037637'}]",,,,
10,1598742302050357248,1598742302050357248,1670004842000.0,2022-12-02 23:44:02,+0530,,"I asked AI how it would destroy the crypto industry if it were assigned the task to do so   Pretty coherent and thorough answer, I'm still mindblown by this thing @OpenAI  https://t.co/9pMzMR2JEj",en,[],[],942999039192186882,942999039192186882,AltcoinPsycho,Psycho,5,23,https://twitter.com/AltcoinPsycho/status/1598742302050357248,[],['https://pbs.twimg.com/media/Fi_foHsUAAATOHa.png'],1,https://pbs.twimg.com/media/Fi_foHsUAAATOHa.png,False,2637,352,466,,None,,,,,,,[],,,,
11,1598600109712777216,1598600109712777216,1669970941000.0,2022-12-02 14:19:01,+0530,,"Damn, even an AI would have done a better job at managing the FTX bankruptcy situation lol  https://t.co/bjEGhwQSPo",en,[],[],942999039192186882,942999039192186882,AltcoinPsycho,Psycho,5,14,https://twitter.com/AltcoinPsycho/status/1598600109712777216,[],['https://pbs.twimg.com/media/Fi9eU64VQAEfBE_.png'],1,https://pbs.twimg.com/media/Fi9eU64VQAEfBE_.png,False,530,45,49,,None,,,,,,,[],,,,
12,1598598179855151104,1598586248503119873,1669970481000.0,2022-12-02 14:11:21,+0530,,@ThePythonQuant it's not even been 24 hours since the tool has been released... use a little imagination to think where this technology will be in 1-2 years,en,[],[],942999039192186882,942999039192186882,AltcoinPsycho,Psycho,5,14,https://twitter.com/AltcoinPsycho/status/1598598179855151104,[],[],0,,False,528,34,3,,None,,,,,,,"[{'screen_name': 'ThePythonQuant', 'name': 'elPythonQuantador', 'id': '1237313316'}]",,,,
13,1598593328450514944,1598593328450514944,1669969324000.0,2022-12-02 13:52:04,+0530,,"I asked AI why people on psychedlics report a maternal feminine presence   ""the motherly figure that people report experiencing on psychedelics may be a manifestation of their own unconscious desires &amp; needs,  or it may be a psychological archetype that represents nurturing""   🤯  https://t.co/fP5ppwUp4J",en,[],[],942999039192186882,942999039192186882,AltcoinPsycho,Psycho,5,13,https://twitter.com/AltcoinPsycho/status/1598593328450514944,[],['https://pbs.twimg.com/media/Fi9YKNPVEAEhezw.png'],1,https://pbs.twimg.com/media/Fi9YKNPVEAEhezw.png,False,318,49,36,,None,,,,,,,[],,,,
14,1598586248503119873,1598586248503119873,1669967636000.0,2022-12-02 13:23:56,+0530,,Just asked AI to write me a python script to create a backtesting engine for trading strategies   The game is truly about to change for devs and algorithmic traders  https://t.co/jnJRSSjgRR,en,[],[],942999039192186882,942999039192186882,AltcoinPsycho,Psycho,5,13,https://twitter.com/AltcoinPsycho/status/1598586248503119873,[],['https://pbs.twimg.com/media/Fi9RgHpUoAAdFm1.png'],1,https://pbs.twimg.com/media/Fi9RgHpUoAAdFm1.png,False,7452,422,770,,None,,,,,,,[],,,,
15,1598582296357265409,1598582296357265409,1669966694000.0,2022-12-02 13:08:14,+0530,,Looks like even the mighty @OpenAI can't provide insight on how to profitably trade options lol  https://t.co/Q28EzUXTZg,en,[],[],942999039192186882,942999039192186882,AltcoinPsycho,Psycho,5,13,https://twitter.com/AltcoinPsycho/status/1598582296357265409,[],['https://pbs.twimg.com/media/Fi9OIFEVQAA9hJN.png'],1,https://pbs.twimg.com/media/Fi9OIFEVQAA9hJN.png,False,131,24,5,,None,,,,,,,[],,,,
16,1598560348411265034,1598558027849703424,1669961461000.0,2022-12-02 11:41:01,+0530,,"@Tradermayne @OpenAI Just asked ChatGPT for you, here's what it said  https://t.co/XIgcPuzNdA",en,[],[],942999039192186882,942999039192186882,AltcoinPsycho,Psycho,5,11,https://twitter.com/AltcoinPsycho/status/1598560348411265034,[],['https://pbs.twimg.com/media/Fi86JjWVIAAp9sZ.jpg'],1,https://pbs.twimg.com/media/Fi86JjWVIAAp9sZ.jpg,False,337,38,1,,None,,,,,,,"[{'screen_name': 'Tradermayne', 'name': 'Mayne', 'id': '2446024556'}, {'screen_name': 'OpenAI', 'name': 'OpenAI', 'id': '4398626122'}]",,,,
17,1598558027849703424,1598558027849703424,1669960908000.0,2022-12-02 11:31:48,+0530,,I don't think people understand how big of a deal @OpenAI chatGPT is  There's been several key moments in the exponential curve of technological advancement: 1) The personal computer 2) The Internet 3) Emails  4) Smartphones  I think ChatGPT will be next,en,[],[],942999039192186882,942999039192186882,AltcoinPsycho,Psycho,5,11,https://twitter.com/AltcoinPsycho/status/1598558027849703424,[],[],0,,False,1382,133,164,,None,,,,,,,[],,,,
18,1598548064801026049,1598415399795953664,1669958532000.0,2022-12-02 10:52:12,+0530,,"@Jiran_z what about ftx quant zone that he created... Idk, I feel like he's just trying to play dumb so he isn't hit with a fraud cause",en,[],[],942999039192186882,942999039192186882,AltcoinPsycho,Psycho,5,10,https://twitter.com/AltcoinPsycho/status/1598548064801026049,[],[],0,,False,7,10,0,,None,,,,,,,"[{'screen_name': 'Jiran_z', 'name': 'jiran.eth | Sherblock Nodes', 'id': '490937904'}]",,,,
19,1598511806393171969,1598343921674993666,1669949888000.0,2022-12-02 08:28:08,+0530,,"@SBF_FTX Are you implying that FTX US had sufficient funds with their ACH bank processor (ie  silvergate), and Silvergate *chose* not to process ACH withdrawals?  Again, these withdrawals were initiated 4-5 days BEFORE chapter 11 &amp; the tx’s were marked as complete on FTX  Where is that $?",en,[],[],942999039192186882,942999039192186882,AltcoinPsycho,Psycho,5,08,https://twitter.com/AltcoinPsycho/status/1598511806393171969,[],[],0,,False,588,75,48,,None,,,,,,,"[{'screen_name': 'SBF_FTX', 'name': 'SBF', 'id': '1110877798820777986'}]",,,,
20,1598474670747287552,1598472220405555200,1669941034000.0,2022-12-02 06:00:34,+0530,,"@DaRealMilkBagz on behalf of my colleagues at the IRS, we thank those for participation in our experimental honey pot",en,[],[],942999039192186882,942999039192186882,AltcoinPsycho,Psycho,5,06,https://twitter.com/AltcoinPsycho/status/1598474670747287552,[],[],0,,False,66,6,0,,None,,,,,,,"[{'screen_name': 'DaRealMilkBagz', 'name': 'Ice Bagz', 'id': '1446715714082115584'}]",,,,
21,1598468767398645760,1598468767398645760,1669939626000.0,2022-12-02 05:37:06,+0530,,think I’m gonna have a stroke if I keep listening to this space,en,[],[],942999039192186882,942999039192186882,AltcoinPsycho,Psycho,5,05,https://twitter.com/AltcoinPsycho/status/1598468767398645760,[],[],0,,False,451,75,9,,None,,,,,,,[],,,,
22,1598466565330309120,1598466565330309120,1669939101000.0,2022-12-02 05:28:21,+0530,,Man I need a drink lol,en,[],[],942999039192186882,942999039192186882,AltcoinPsycho,Psycho,5,05,https://twitter.com/AltcoinPsycho/status/1598466565330309120,[],[],0,,False,223,35,7,,None,,,,,,,[],,,,
23,1598456009751949313,1598456009751949313,1669936585000.0,2022-12-02 04:46:25,+0530,,"Glad the space hosts pinned the below tweet and asked SBF my question (which is wire fraud, btw)  Too bad SBF weasled his way out of truly answering it and gave a bunch of verbal diarrhea. He needs to be pressed harder on this",en,[],[],942999039192186882,942999039192186882,AltcoinPsycho,Psycho,5,04,https://twitter.com/AltcoinPsycho/status/1598456009751949313,[],[],0,,False,243,30,18,https://twitter.com/AltcoinPsycho/status/1598352109023690752,None,,,,,,,[],,,,
24,1598453847546302465,1598453847546302465,1669936069000.0,2022-12-02 04:37:49,+0530,,How can anyone listen to this space and not think SBF is a sociopathic liar,en,[],[],942999039192186882,942999039192186882,AltcoinPsycho,Psycho,5,04,https://twitter.com/AltcoinPsycho/status/1598453847546302465,[],[],0,,False,968,113,49,,None,,,,,,,[],,,,
25,1598416630232776704,1598415399795953664,1669927196000.0,2022-12-02 02:09:56,+0530,,this man literally started a quant trading firm then tried gaslighting us by saying he doesn’t know how to code  https://t.co/jmU6z1CruP,en,[],[],942999039192186882,942999039192186882,AltcoinPsycho,Psycho,5,02,https://twitter.com/AltcoinPsycho/status/1598416630232776704,[],['https://pbs.twimg.com/media/Fi63dAbVIAA7yI0.jpg'],1,https://pbs.twimg.com/media/Fi63dAbVIAA7yI0.jpg,False,196,12,1,,None,,,,,,,[],,,,
26,1598415399795953664,1598415399795953664,1669926903000.0,2022-12-02 02:05:03,+0530,,"SBF in NYT interview: I don’t know how to code, so I didn’t create the back door withdrawal code   Also SBF: I was a quant trader at Jane Street",en,[],[],942999039192186882,942999039192186882,AltcoinPsycho,Psycho,5,02,https://twitter.com/AltcoinPsycho/status/1598415399795953664,[],[],0,,False,385,31,48,https://twitter.com/sbf_ftx/status/1507520788798320645,None,,,,,,,[],,,,
27,1598401501948309504,1598395915358072832,1669923589000.0,2022-12-02 01:09:49,+0530,,"@LordBogdanoff they crowdfunded that screecher 10k to vacation at the bahamas, I'm sure we could crowdfund this too",en,[],[],942999039192186882,942999039192186882,AltcoinPsycho,Psycho,5,01,https://twitter.com/AltcoinPsycho/status/1598401501948309504,[],[],0,,False,2,2,0,,None,,,,,,,"[{'screen_name': 'LordBogdanoff', 'name': 'GravityWell', 'id': '1017279077860954112'}]",,,,
28,1598400748802318336,1598398376940183552,1669923410000.0,2022-12-02 01:06:50,+0530,,@Mister_Ch0c @StrongHedge how much do you think you need to keep it alive?,en,[],[],942999039192186882,942999039192186882,AltcoinPsycho,Psycho,5,01,https://twitter.com/AltcoinPsycho/status/1598400748802318336,[],[],0,,False,9,4,0,,None,,,,,,,"[{'screen_name': 'Mister_Ch0c', 'name': 'MisterCh0c', 'id': '1205909348557426688'}, {'screen_name': 'StrongHedge', 'name': '$trong', 'id': '1246516942636277761'}]",,,,
29,1598398800275857409,1598393076682174464,1669922945000.0,2022-12-02 00:59:05,+0530,,@CryptoKaleo appreciate it king &lt;3,en,[],[],942999039192186882,942999039192186882,AltcoinPsycho,Psycho,5,00,https://twitter.com/AltcoinPsycho/status/1598398800275857409,[],[],0,,False,33,4,1,,None,,,,,,,"[{'screen_name': 'CryptoKaleo', 'name': 'K A L E O', 'id': '906234475604037637'}]",,,,
30,1598352109023690752,1598343921674993666,1669911813000.0,2022-12-01 21:53:33,+0530,,"@SBF_FTX What about the thousands of customers who did an ACH withdrawal pre-bankruptcy announcement and never received money in their bank?  If FTX US was fully solvent, then the bank account used to process ACH withdrawals would have continued processing no?",en,[],[],942999039192186882,942999039192186882,AltcoinPsycho,Psycho,4,21,https://twitter.com/AltcoinPsycho/status/1598352109023690752,[],[],0,,False,2046,100,97,,None,,,,,,,"[{'screen_name': 'SBF_FTX', 'name': 'SBF', 'id': '1110877798820777986'}]",,,,
31,1598125711625433088,1598125711625433088,1669857836000.0,2022-12-01 06:53:56,+0530,,man who accidentally lost $10B also accidentally eats 3000 shrimp,en,[],[],942999039192186882,942999039192186882,AltcoinPsycho,Psycho,4,06,https://twitter.com/AltcoinPsycho/status/1598125711625433088,[],[],0,,False,915,78,81,https://twitter.com/ryaneshea/status/1598094603106025472,None,,,,,,,[],,,,
32,1598090692039184398,1598090692039184398,1669849486000.0,2022-12-01 04:34:46,+0530,,SBFs lawyers after this interview  https://t.co/7ROW4KGvYh,en,[],[],942999039192186882,942999039192186882,AltcoinPsycho,Psycho,4,04,https://twitter.com/AltcoinPsycho/status/1598090692039184398,[],['https://pbs.twimg.com/media/Fi2PA9QVIAALYyM.jpg'],1,https://pbs.twimg.com/media/Fi2PA9QVIAALYyM.jpg,False,342,13,30,,None,,,,,,,[],,,,
33,1598088461952913412,1598088461952913412,1669848955000.0,2022-12-01 04:25:55,+0530,,"SBF: ""We were spending an enormous amount of time on compliance... I think we were spending too much on [compliance] frankly""  🤨",en,[],[],942999039192186882,942999039192186882,AltcoinPsycho,Psycho,4,04,https://twitter.com/AltcoinPsycho/status/1598088461952913412,[],[],0,,False,206,35,15,,None,,,,,,,[],,,,
34,1598085267365453825,1598085267365453825,1669848193000.0,2022-12-01 04:13:13,+0530,,prediction market on wen prison for SBF?,en,[],[],942999039192186882,942999039192186882,AltcoinPsycho,Psycho,4,04,https://twitter.com/AltcoinPsycho/status/1598085267365453825,[],[],0,,False,179,34,5,,None,,,,,,,[],,,,
35,1598084166801055745,1598084023167090688,1669847930000.0,2022-12-01 04:08:50,+0530,,"@twobitidiot tbh, they do have him on the hot seat rn with some tough questions. It's worth the watch",en,[],[],942999039192186882,942999039192186882,AltcoinPsycho,Psycho,4,04,https://twitter.com/AltcoinPsycho/status/1598084166801055745,[],[],0,,False,28,4,0,,None,,,,,,,"[{'screen_name': 'twobitidiot', 'name': 'Ryan Selkis 🥷', 'id': '2193616844'}]",,,,
36,1598079845304799232,1598079845304799232,1669846900000.0,2022-12-01 03:51:40,+0530,,my god this SBF interview is horrid   delusion at levels I have't seen since bitcoin cash days,en,[],[],942999039192186882,942999039192186882,AltcoinPsycho,Psycho,4,03,https://twitter.com/AltcoinPsycho/status/1598079845304799232,[],[],0,,False,573,51,27,,None,,,,,,,[],,,,
37,1598063378890911745,1598056426257383424,1669842974000.0,2022-12-01 02:46:14,+0530,,@IamNomad @edbwt based,en,[],[],942999039192186882,942999039192186882,AltcoinPsycho,Psycho,4,02,https://twitter.com/AltcoinPsycho/status/1598063378890911745,[],[],0,,False,20,1,0,,None,,,,,,,"[{'screen_name': 'IamNomad', 'name': 'IamNomad', 'id': '22341856'}, {'screen_name': 'edbwt', 'name': 'Edwin den Boer', 'id': '2899867251'}]",,,,
38,1598027399522050048,1598025932690034689,1669834396000.0,2022-12-01 00:23:16,+0530,,@ByzGeneral The wonderful world of “Fedspeak”,en,[],[],942999039192186882,942999039192186882,AltcoinPsycho,Psycho,4,00,https://twitter.com/AltcoinPsycho/status/1598027399522050048,[],[],0,,False,48,12,0,https://twitter.com/AltcoinPsycho/status/1486428814531985410,None,,,,,,,"[{'screen_name': 'ByzGeneral', 'name': 'Byzantine General', 'id': '1098266607594455041'}]",,,,
39,1597860245887336453,1597846585903570945,1669794544000.0,2022-11-30 13:19:04,+0530,,@MaxieRyan Wild night at the bingo lounge?,en,[],[],942999039192186882,942999039192186882,AltcoinPsycho,Psycho,3,13,https://twitter.com/AltcoinPsycho/status/1597860245887336453,[],[],0,,False,14,12,0,,None,,,,,,,"[{'screen_name': 'MaxieRyan', 'name': 'MaxineRyan.eth', 'id': '3182277606'}]",,,,
40,1597656268369690625,1597656268369690625,1669745912000.0,2022-11-29 23:48:32,+0530,,Publicized 2 more free scripts today:  1) Altcoin Volume Shelf Scanner: Scans alts to look for price consolidation around a volume shelf using aVWAP &amp; SMA filter  https://t.co/cvUrZYIFTf  2) Fair Value Gap Scanner: Scans alts for Fair Value Gap (FVG) setups  https://t.co/ozRJWL7Qtg,en,[],[],942999039192186882,942999039192186882,AltcoinPsycho,Psycho,2,23,https://twitter.com/AltcoinPsycho/status/1597656268369690625,"['http://charts.trendspider.com/shared/63864b6f207eac0015778e4e?t=1', 'http://charts.trendspider.com/shared/63864bca207eac0015778e4f?t=1']",[],0,,False,335,22,39,https://twitter.com/AltcoinPsycho/status/1591831436033916928,None,,,,,,,[],,,,
41,1597491841045508096,1597491841045508096,1669706709000.0,2022-11-29 12:55:09,+0530,,Interesting how @AlamedaTrabucco has been completely silent and out of the media’s eye during this FTX / Alameda mess,en,[],[],942999039192186882,942999039192186882,AltcoinPsycho,Psycho,2,12,https://twitter.com/AltcoinPsycho/status/1597491841045508096,[],[],0,,False,817,98,36,,None,,,,,,,[],,,,
42,1597470546505388032,1597378593201393664,1669701632000.0,2022-11-29 11:30:32,+0530,,"@lawmaster I feel like the 2018 / 2019 main character was Arthur Hayes, and that didn't end too well for him",en,[],[],942999039192186882,942999039192186882,AltcoinPsycho,Psycho,2,11,https://twitter.com/AltcoinPsycho/status/1597470546505388032,[],[],0,,False,43,15,0,,None,,,,,,,"[{'screen_name': 'lawmaster', 'name': 'Larry Cermak \U0001fae1', 'id': '16709601'}]",,,,
43,1597436448982331393,1597431457466974209,1669693503000.0,2022-11-29 09:15:03,+0530,,@inversebrah @Awawat_Trades hmmm where have I heard this before  https://t.co/8UVCw1Ndnm,en,[],[],942999039192186882,942999039192186882,AltcoinPsycho,Psycho,2,09,https://twitter.com/AltcoinPsycho/status/1597436448982331393,[],['https://pbs.twimg.com/tweet_video_thumb/Fis7-oWVQAAuxy6.jpg'],1,https://pbs.twimg.com/tweet_video_thumb/Fis7-oWVQAAuxy6.jpg,False,37,12,0,,None,,,,,,,"[{'screen_name': 'inversebrah', 'name': 'smolting (wassie, verse)', 'id': '1051852534518824960'}, {'screen_name': 'Awawat_Trades', 'name': 'Awawat', 'id': '1281133175658254336'}]",,,,
44,1597396624086421505,1597320587684511744,1669684008000.0,2022-11-29 06:36:48,+0530,,"@davidbelle_ He’s a US citizen and was the CEO of FTX US, they could do whatever they want if they really cared",en,[],[],942999039192186882,942999039192186882,AltcoinPsycho,Psycho,2,06,https://twitter.com/AltcoinPsycho/status/1597396624086421505,[],[],0,,False,104,12,0,,None,,,,,,,"[{'screen_name': 'davidbelle_', 'name': 'David Belle', 'id': '3688307962'}]",,,,
45,1597378593201393664,1597378593201393664,1669679709000.0,2022-11-29 05:25:09,+0530,,"Crypto rule #1, don’t become the main character.   CZ just inherited the main character role, wether he wants it or not   Will be interesting to see how it plays out",en,[],[],942999039192186882,942999039192186882,AltcoinPsycho,Psycho,2,05,https://twitter.com/AltcoinPsycho/status/1597378593201393664,[],[],0,,False,1964,147,104,,None,,,,,,,[],,,,
46,1597124277295144960,1597107967962202112,1669619075000.0,2022-11-28 12:34:35,+0530,,@NaniXBT,qam,[],[],942999039192186882,942999039192186882,AltcoinPsycho,Psycho,1,12,https://twitter.com/AltcoinPsycho/status/1597124277295144960,[],[],0,,False,22,4,1,,None,,,,,,,[],,,,
47,1597107967962202112,1597107967962202112,1669615187000.0,2022-11-28 11:29:47,+0530,,"Following Nani was a mistake my entire feed is now wrapped eth, help",en,[],[],942999039192186882,942999039192186882,AltcoinPsycho,Psycho,1,11,https://twitter.com/AltcoinPsycho/status/1597107967962202112,[],[],0,,False,194,26,4,,None,,,,,,,[],,,,
48,1597080199950397441,1597068375876079617,1669608566000.0,2022-11-28 09:39:26,+0530,,@CryptoCred @WClementeIII The patrician’s choice,en,[],[],942999039192186882,942999039192186882,AltcoinPsycho,Psycho,1,09,https://twitter.com/AltcoinPsycho/status/1597080199950397441,[],[],0,,False,20,2,0,,None,,,,,,,"[{'screen_name': 'CryptoCred', 'name': 'Cred', 'id': '899558268795842561'}, {'screen_name': 'WClementeIII', 'name': 'Will Clemente', 'id': '1270906326823186432'}]",,,,
49,1597074319904890880,1597068375876079617,1669607164000.0,2022-11-28 09:16:04,+0530,,@WClementeIII I remember feeling the same in 2017 and then my alts just never recovered,en,[],[],942999039192186882,942999039192186882,AltcoinPsycho,Psycho,1,09,https://twitter.com/AltcoinPsycho/status/1597074319904890880,[],[],0,,False,231,12,3,,None,,,,,,,"[{'screen_name': 'WClementeIII', 'name': 'Will Clemente', 'id': '1270906326823186432'}]",,,,
50,1597036921284603905,1597036921284603905,1669598248000.0,2022-11-28 06:47:28,+0530,,did you knobs really crowdfund a guy $10k to go screech around the Bahamas with his shirt off?,en,[],[],942999039192186882,942999039192186882,AltcoinPsycho,Psycho,1,06,https://twitter.com/AltcoinPsycho/status/1597036921284603905,[],[],0,,False,770,73,13,,None,,,,,,,[],,,,
51,1596968144345890816,1596948970755850240,1669581850000.0,2022-11-28 02:14:10,+0530,,@SimSimS73110194 don't trust me and assume I'm a broke larp,en,[],[],942999039192186882,942999039192186882,AltcoinPsycho,Psycho,1,02,https://twitter.com/AltcoinPsycho/status/1596968144345890816,[],[],0,,False,27,5,0,,None,,,,,,,"[{'screen_name': 'SimSimS73110194', 'name': 'Nic_nevim🇺🇦', 'id': '1369732011313815552'}]",,,,
52,1596948970755850240,1596948970755850240,1669577279000.0,2022-11-28 00:57:59,+0530,,"As promised, publicized my scanners:  1) Dip buy: Scans for coins w/ bullish trend + 9% dump after 19% rally  https://t.co/CB9hU9WvfD  2) Rally short: Scans for coins w/ bearish trend + 9% rally after 19% dump  https://t.co/wtrlZQj0rS  More to come soon including tradingview tools",en,[],[],942999039192186882,942999039192186882,AltcoinPsycho,Psycho,1,00,https://twitter.com/AltcoinPsycho/status/1596948970755850240,"['http://charts.trendspider.com/shared/6383ad6f207eac0015778dc3?t=4', 'http://charts.trendspider.com/shared/6383b76a207eac0015778dc7?t=1']",[],0,,False,1093,41,170,https://twitter.com/AltcoinPsycho/status/1591831436033916928,None,,,,,,,[],,,,
53,1596923755917213696,1596917941119090688,1669571267000.0,2022-11-27 23:17:47,+0530,,@MoonOverlord @Pentosh1 to be fair it’s probably the worst event that’s ever happened in crypto haha  FTX felt 10x worse than gox,en,[],[],942999039192186882,942999039192186882,AltcoinPsycho,Psycho,7,23,https://twitter.com/AltcoinPsycho/status/1596923755917213696,[],[],0,,False,125,16,1,,None,,,,,,,"[{'screen_name': 'MoonOverlord', 'name': 'moon', 'id': '938606626017370112'}, {'screen_name': 'Pentosh1', 'name': 'Pentoshi 🐧', 'id': '1138993163706753029'}]",,,,
54,1596674851942825984,1596674851942825984,1669511924000.0,2022-11-27 06:48:44,+0530,,I wouldn’t touch Solana with a 10 foot pole until this resolves,en,[],[],942999039192186882,942999039192186882,AltcoinPsycho,Psycho,7,06,https://twitter.com/AltcoinPsycho/status/1596674851942825984,[],[],0,,False,1156,119,138,https://twitter.com/618_cowboy/status/1596198586035077121,None,,,,,,,[],,,,
55,1596653646649126914,1596653646649126914,1669506868000.0,2022-11-27 05:24:28,+0530,,The manifestooor   https://t.co/bGmZlKaAjA,en,[],[],942999039192186882,942999039192186882,AltcoinPsycho,Psycho,7,05,https://twitter.com/AltcoinPsycho/status/1596653646649126914,['https://polymarket.com/market/will-sbf-or-bitboy-be-arrested-first'],[],0,,False,129,13,7,https://twitter.com/AltcoinPsycho/status/1596638140227145729,None,,,,,,,[],,,,
56,1596645503260712960,1596645503260712960,1669504926000.0,2022-11-27 04:52:06,+0530,,should we all just squad up to the bahamas rn?  would be pretty fk'ing hilarious,en,[],[],942999039192186882,942999039192186882,AltcoinPsycho,Psycho,7,04,https://twitter.com/AltcoinPsycho/status/1596645503260712960,[],[],0,,False,510,49,23,https://twitter.com/SizeChad/status/1596645023176708096,None,,,,,,,[],,,,
