,id,conversation_id,created_at,date,timezone,place,tweet,language,hashtags,cashtags,user_id,user_id_str,username,name,day,hour,link,urls,photos,video,thumbnail,retweet,nlikes,nreplies,nretweets,quote_url,search,near,geo,source,user_rt_id,user_rt,retweet_id,reply_to,retweet_date,translate,trans_src,trans_dest
0,1599392024075309057,1599392024075309057,1670159748000.0,2022-12-04 18:45:48,+0530,,⚠️ Beware of fake accounts pretending to be Ankr.   Our only official Twitter accounts are @ankr and @ankrstaking.   Our mods and admins never DM first.   For other channels refer to our Linktree:  https://t.co/Wm31IdgXze.,en,[],[],1010430329218371584,1010430329218371584,ankr,Ankr,7,18,https://twitter.com/ankr/status/1599392024075309057,['https://linktr.ee/ankrofficial'],[],0,,False,84,25,22,,None,,,,,,,[],,,,
1,1599357876887519232,1599357858943881218,1670151607000.0,2022-12-04 16:30:07,+0530,,8/ Our team is working 24/7 to compensate affected users.,en,[],[],1010430329218371584,1010430329218371584,ankr,Ankr,7,16,https://twitter.com/ankr/status/1599357876887519232,[],[],0,,False,59,22,3,,None,,,,,,,[],,,,
2,1599357874396106752,1599357858943881218,1670151606000.0,2022-12-04 16:30:06,+0530,,"7/ DEXs cannot be blocked however, and even if it was possible, it would have been too late to block it manually by the DEX team due to how DeFi protocols are run.",en,[],[],1010430329218371584,1010430329218371584,ankr,Ankr,7,16,https://twitter.com/ankr/status/1599357874396106752,[],[],0,,False,43,9,2,,None,,,,,,,[],,,,
3,1599357871900106752,1599357858943881218,1670151605000.0,2022-12-04 16:30:05,+0530,,6/ The only exit then available to the exploiter was to sell aBNBc vs BNB on DEX’s since we blocked unstaking.,en,[],[],1010430329218371584,1010430329218371584,ankr,Ankr,7,16,https://twitter.com/ankr/status/1599357871900106752,[],[],0,,False,33,7,1,,None,,,,,,,[],,,,
4,1599357869387788288,1599357858943881218,1670151605000.0,2022-12-04 16:30:05,+0530,,"5/ Why did selling stop but buying continued?  There was no more BNB in LPs to sell aBNBb and aBNBc.  It was drained out by the exploiter, who had unlimited amount of aBNBc that he sold on DEXs vs BNB until drying out completely the liquidity pools (=0% BNB/100% aBNBc in the LPs)",en,[],[],1010430329218371584,1010430329218371584,ankr,Ankr,7,16,https://twitter.com/ankr/status/1599357869387788288,[],[],0,,False,32,6,1,,None,,,,,,,[],,,,
5,1599357866799820801,1599357858943881218,1670151604000.0,2022-12-04 16:30:04,+0530,,"4/ We recommend that anyone providing liquidity to remove it, in order to avoid speculative trading, since DEXs cannot generally block the ability to trade.   Ankr also cannot block speculative trading as we cannot control other DeFi protocols.",en,[],[],1010430329218371584,1010430329218371584,ankr,Ankr,7,16,https://twitter.com/ankr/status/1599357866799820801,[],[],0,,False,33,6,2,,None,,,,,,,[],,,,
6,1599357864073924608,1599357858943881218,1670151604000.0,2022-12-04 16:30:04,+0530,,3/ We are absolutely not following a LUNA approach.   aBNBc and aBNBb will be worthless with 100% certainty after the airdrop of the new ankrBNB token.  ankrBNB will be the only token redeemable against staked BNB (which have been unaffected by the exploit).,en,[],[],1010430329218371584,1010430329218371584,ankr,Ankr,7,16,https://twitter.com/ankr/status/1599357864073924608,[],[],0,,False,38,9,2,,None,,,,,,,[],,,,
7,1599357861305253888,1599357858943881218,1670151603000.0,2022-12-04 16:30:03,+0530,,"2/ DEXs themselves very often do not have the ability to stop tradability, which is why Ankr recommended liquidity providers remove liquidity from the liquidity pools.",en,[],[],1010430329218371584,1010430329218371584,ankr,Ankr,7,16,https://twitter.com/ankr/status/1599357861305253888,[],[],0,,False,33,4,1,,None,,,,,,,[],,,,
8,1599357858943881218,1599357858943881218,1670151602000.0,2022-12-04 16:30:02,+0530,,We have been getting multiple questions to why trading is halted for our aBNB tokens.  Reasons and in-depth technical explanation.  A 🧵,en,[],[],1010430329218371584,1010430329218371584,ankr,Ankr,7,16,https://twitter.com/ankr/status/1599357858943881218,[],[],0,,False,171,45,46,,None,,,,,,,[],,,,
9,1598807298863874048,1598807298863874048,1670020339000.0,2022-12-03 04:02:19,+0530,,Thank you for the support and collaboration! 💙,en,[],[],1010430329218371584,1010430329218371584,ankr,Ankr,6,04,https://twitter.com/ankr/status/1598807298863874048,[],[],0,,False,127,21,29,https://twitter.com/Helio_Money/status/1598783037092859915,None,,,,,,,[],,,,
10,1598803911443468289,1598768146088742912,1670019531000.0,2022-12-03 03:48:51,+0530,,"2/ Ankr team is working with our partners  @pStakeFinance,@WombatExchange, @staderlabs,  @izumi_Finance, @Ellipsisfi, @beefyfinance , @QuollFinance, @KalmyAPP, @Helio_Money, &amp; @MidasCapitalxyz on achieving an agreement to resolve this.",en,[],[],1010430329218371584,1010430329218371584,ankr,Ankr,6,03,https://twitter.com/ankr/status/1598803911443468289,[],[],0,,False,54,13,16,,None,,,,,,,[],,,,
11,1598768163709067264,1598768146088742912,1670011008000.0,2022-12-03 01:26:48,+0530,,"8/ Dozens of protocols, customers, and community members offered to help and support. Thank you! 🙏🫡 #wagmi  💙 Ankr Team",en,['wagmi'],[],1010430329218371584,1010430329218371584,ankr,Ankr,6,01,https://twitter.com/ankr/status/1598768163709067264,[],[],0,,False,76,9,4,,None,,,,,,,[],,,,
12,1598768161196605440,1598768146088742912,1670011007000.0,2022-12-03 01:26:47,+0530,,"7/ We understand diluted aBNBc was speculatively traded after the exploit occurred, but we are only able to compensate LP’s caught off guard by the event.",en,[],[],1010430329218371584,1010430329218371584,ankr,Ankr,6,01,https://twitter.com/ankr/status/1598768161196605440,[],[],0,,False,52,17,6,,None,,,,,,,[],,,,
13,1598768158696910848,1598768146088742912,1670011007000.0,2022-12-03 01:26:47,+0530,,6/ The only users at risk were liquidity providers. We have started creating a list of the ones affected to make sure that we fully compensate them.,en,[],[],1010430329218371584,1010430329218371584,ankr,Ankr,6,01,https://twitter.com/ankr/status/1598768158696910848,[],[],0,,False,52,6,4,,None,,,,,,,[],,,,
14,1598768156243243008,1598768146088742912,1670011006000.0,2022-12-03 01:26:46,+0530,,5/ They immediately began using DEXs to trade through LPs. Ultimately draining ~$5m USD.  We promptly responded with the help of many DEXs that halted the trading of the aBNB tokens immediately upon discovering the breach.,en,[],[],1010430329218371584,1010430329218371584,ankr,Ankr,6,01,https://twitter.com/ankr/status/1598768156243243008,[],[],0,,False,49,11,4,,None,,,,,,,[],,,,
15,1598768153726660608,1598768146088742912,1670011006000.0,2022-12-03 01:26:46,+0530,,4/ A hacker was able to compromise a deployer’s private key after the Ankr team carried out an upgrade (pending law enforcement investigation).  The attacker used the deployer keys to modify the smart contract that allowed for unlimited minting of aBNBc.,en,[],[],1010430329218371584,1010430329218371584,ankr,Ankr,6,01,https://twitter.com/ankr/status/1598768153726660608,[],[],0,,False,50,7,6,,None,,,,,,,[],,,,
16,1598768151340101634,1598768146088742912,1670011005000.0,2022-12-03 01:26:45,+0530,,"3/ ❗️All staked assets on @ankrstaking are secure, and all infrastructure services were unaffected.",en,[],[],1010430329218371584,1010430329218371584,ankr,Ankr,6,01,https://twitter.com/ankr/status/1598768151340101634,[],[],0,,False,42,9,4,,None,,,,,,,[],,,,
17,1598768146088742912,1598768146088742912,1670011004000.0,2022-12-03 01:26:44,+0530,,"Update on our aBNB Token Exploit:  We are grateful to our community of DEXs, exchanges, and protocols that all helped us end the exploit quickly.  We will use reserves to compensate liquidity providers for the aBNBc pools.   https://t.co/B2yNWBAQdX",en,[],[],1010430329218371584,1010430329218371584,ankr,Ankr,6,01,https://twitter.com/ankr/status/1598768146088742912,['https://www.ankr.com/blog/the-abnbc-token-report/'],[],0,,False,221,102,55,,None,,,,,,,[],,,,
18,1598657220132085760,1598624443642703872,1669984557000.0,2022-12-02 18:05:57,+0530,,"5/ All of your questions will be answered in our community channels where all our community managers are at the disposal of our users.  Our Telegram, Discord and Reddit:  https://t.co/Wm31IdgpJG.",en,[],[],1010430329218371584,1010430329218371584,ankr,Ankr,5,18,https://twitter.com/ankr/status/1598657220132085760,['https://linktr.ee/ankrofficial'],[],0,,False,62,42,6,,None,,,,,,,[],,,,
19,1598627862545940481,1598503332477280256,1669977558000.0,2022-12-02 16:09:18,+0530,,@0xGeeGee Our other c-tokens are not vulnerable but we have paused staking completely until further notice.,en,[],[],1010430329218371584,1010430329218371584,ankr,Ankr,5,16,https://twitter.com/ankr/status/1598627862545940481,[],[],0,,False,11,3,0,,None,,,,,,,"[{'screen_name': '0xGeeGee', 'name': '0xGeeGee', 'id': '1500971484612902917'}]",,,,
20,1598624449774833665,1598624443642703872,1669976744000.0,2022-12-02 15:55:44,+0530,,4/ Ankr understands the concern this has created within the community and will continue working to mitigate the situation and has already taken the necessary steps to prevent future similar incidents.,en,[],[],1010430329218371584,1010430329218371584,ankr,Ankr,5,15,https://twitter.com/ankr/status/1598624449774833665,[],[],0,,False,86,28,9,,None,,,,,,,[],,,,
21,1598624447203770369,1598624443642703872,1669976743000.0,2022-12-02 15:55:43,+0530,,"3/ Additionally, Ankr will purchase 5m worth of BNB and use this to compensate in totality the liquidity providers that have been affected by the exploit due to the drainage of the liquidity pool.",en,[],[],1010430329218371584,1010430329218371584,ankr,Ankr,5,15,https://twitter.com/ankr/status/1598624447203770369,[],[],0,,False,135,20,13,,None,,,,,,,[],,,,
22,1598624445618393089,1598624443642703872,1669976743000.0,2022-12-02 15:55:43,+0530,,"2/ We will take a snapshot and reissue ankrBNB to all valid aBNBc holders before the exploit.  The ankrBNB token will continue to be redeemable, while aBNBc and aBNBb will no longer be redeemable.",en,[],[],1010430329218371584,1010430329218371584,ankr,Ankr,5,15,https://twitter.com/ankr/status/1598624445618393089,[],[],0,,False,85,16,8,,None,,,,,,,[],,,,
23,1598624443642703872,1598624443642703872,1669976743000.0,2022-12-02 15:55:43,+0530,,The team at Ankr has assessed the damage and it is max 5M USD worth of BNB from the liquidity pools.  We are currently working hard to resolve this issue efficiently and we would like to propose the following to address the current situation:,en,[],[],1010430329218371584,1010430329218371584,ankr,Ankr,5,15,https://twitter.com/ankr/status/1598624443642703872,[],[],0,,False,405,112,97,,None,,,,,,,[],,,,
24,1598579954643509250,1598503332477280256,1669966136000.0,2022-12-02 12:58:56,+0530,,We are currently drafting a plan and we are committed to compensating affected users.,en,[],[],1010430329218371584,1010430329218371584,ankr,Ankr,5,12,https://twitter.com/ankr/status/1598579954643509250,[],[],0,,False,123,39,20,,None,,,,,,,[],,,,
25,1598575897946296320,1598503332477280256,1669965168000.0,2022-12-02 12:42:48,+0530,,Additional details:  We have been in touch with the DEXes and told them to block trading. We will reissue tokens in the future after we assess the situation.,en,[],[],1010430329218371584,1010430329218371584,ankr,Ankr,5,12,https://twitter.com/ankr/status/1598575897946296320,[],[],0,,False,94,25,5,,None,,,,,,,[],,,,
26,1598570449390260226,1598503332477280256,1669963869000.0,2022-12-02 12:21:09,+0530,,Further instructions from the Ankr team:  1. Do not trade 2. Remove liquidity from DEXes if you are a liquidity provider (and keep the aBNBc) 3. Snapshot will be done and wait for additional news 4. Will do a reissuance of aBNBc,en,[],[],1010430329218371584,1010430329218371584,ankr,Ankr,5,12,https://twitter.com/ankr/status/1598570449390260226,[],[],0,,False,106,30,21,,None,,,,,,,[],,,,
27,1598510347563966466,1598503332477280256,1669949540000.0,2022-12-02 08:22:20,+0530,,"All underlying assets on Ankr Staking are safe at this time, and all infrastructure services are unaffected.",en,[],[],1010430329218371584,1010430329218371584,ankr,Ankr,5,08,https://twitter.com/ankr/status/1598510347563966466,[],[],0,,False,199,39,27,,None,,,,,,,[],,,,
28,1598503332477280256,1598503332477280256,1669947867000.0,2022-12-02 07:54:27,+0530,,"Our aBNB token has been exploited, and we are currently working with exchanges to immediately halt trading.",en,[],[],1010430329218371584,1010430329218371584,ankr,Ankr,5,07,https://twitter.com/ankr/status/1598503332477280256,[],[],0,,False,1012,213,337,,None,,,,,,,[],,,,
29,1598346362319355906,1598346339292631041,1669910443000.0,2022-12-01 21:30:43,+0530,,7/ 🗞 We have just released a new blog article regarding this change!  Read about it in more details 👇  https://t.co/rp4vvodEFt,en,[],[],1010430329218371584,1010430329218371584,ankr,Ankr,4,21,https://twitter.com/ankr/status/1598346362319355906,['https://www.ankr.com/blog/ankr-announces-token-model-change-for-all-reward-bearing-and-earning-tokens/'],[],0,,False,34,1,3,,None,,,,,,,[],,,,
30,1598346359718875137,1598346339292631041,1669910442000.0,2022-12-01 21:30:42,+0530,,6/ Will Ankr's services be affected by the change? 🗒  Our services are not changing and we continue to provide everything you are already used to with even more features coming 🫡,en,[],[],1010430329218371584,1010430329218371584,ankr,Ankr,4,21,https://twitter.com/ankr/status/1598346359718875137,[],[],0,,False,36,3,5,,None,,,,,,,[],,,,
31,1598346357206437893,1598346339292631041,1669910442000.0,2022-12-01 21:30:42,+0530,,"5/ I am a holder of b-tokens, what should I do? 👀  Ankr will gradually stop support of b-tokens.  You can switch your b-tokens for c-tokens at any time and will only need to cover the ⛽️ fees - without having to pay additional switch costs.  Minting of b-tokens will stop 🚫",en,[],[],1010430329218371584,1010430329218371584,ankr,Ankr,4,21,https://twitter.com/ankr/status/1598346357206437893,[],[],0,,False,18,2,2,,None,,,,,,,[],,,,
32,1598346353351933952,1598346339292631041,1669910441000.0,2022-12-01 21:30:41,+0530,,"4/ How will names look from now on? 💭  The new nomenclature will see all reward-bearing tokens change names based on a new, more consistent standard  • aETHc becomes AnkrETH • aBNBc becomes AnkrBNB • aAVAXc becomes AnkrAVAX  and so on...  https://t.co/yOVZJnhwiv",en,[],[],1010430329218371584,1010430329218371584,ankr,Ankr,4,21,https://twitter.com/ankr/status/1598346353351933952,[],['https://pbs.twimg.com/media/Fi53iNwUoAAlA2x.jpg'],1,https://pbs.twimg.com/media/Fi53iNwUoAAlA2x.jpg,False,26,4,2,,None,,,,,,,[],,,,
33,1598346346095792133,1598346339292631041,1669910439000.0,2022-12-01 21:30:39,+0530,,"3/ What are the current Liquid Staking tokens offered by @ankrstaking? 🤔  • Reward Bearing Tokens (c-tokens), e.g. aETHc formerly aETH • Reward Earning Tokens (b-tokens), e.g. aAVAXb and aETHb (formerly fETH.)",en,[],[],1010430329218371584,1010430329218371584,ankr,Ankr,4,21,https://twitter.com/ankr/status/1598346346095792133,[],[],0,,False,19,2,2,,None,,,,,,,[],,,,
34,1598346343444926465,1598346339292631041,1669910438000.0,2022-12-01 21:30:38,+0530,,2/ Today we are announcing a new nomenclature for our token model that will see the names of reward-bearing tokens change and the complete removal of our reward-earning tokens.,en,[],[],1010430329218371584,1010430329218371584,ankr,Ankr,4,21,https://twitter.com/ankr/status/1598346343444926465,[],[],0,,False,15,2,1,,None,,,,,,,[],,,,
35,1598346339292631041,1598346339292631041,1669910437000.0,2022-12-01 21:30:37,+0530,,"📣 We are introducing changes to all Reward Bearing and Earning Tokens token models.  This is a strategic decision that we believe will best serve our community of holders, stakers and liquidity providers 🤝  For a better understanding, read the 🧵 below.   https://t.co/N6RjZOtUYH  https://t.co/v7wuQnnx8g",en,[],[],1010430329218371584,1010430329218371584,ankr,Ankr,4,21,https://twitter.com/ankr/status/1598346339292631041,['https://www.ankr.com/about-staking/'],['https://pbs.twimg.com/media/Fi53hc0VEAAwYoo.jpg'],1,https://pbs.twimg.com/media/Fi53hc0VEAAwYoo.jpg,False,90,12,17,,None,,,,,,,[],,,,
36,1598311391605170177,1598311391605170177,1669902105000.0,2022-12-01 19:11:45,+0530,,"With nodes in every corner of the globe and intelligent load-balancing, rest assured that you have the resiliency, uptime, and speed you need ⚡️ 😉  Learn more at  https://t.co/BK12zbXc0m  https://t.co/zTba8ehScZ",en,[],[],1010430329218371584,1010430329218371584,ankr,Ankr,4,19,https://twitter.com/ankr/status/1598311391605170177,['https://www.ankr.com/'],['https://pbs.twimg.com/media/Fi5XsDNXwAIOFeb.jpg'],1,https://pbs.twimg.com/media/Fi5XsDNXwAIOFeb.jpg,False,71,2,15,,None,,,,,,,[],,,,
37,1598285855864520705,1598285855864520705,1669896017000.0,2022-12-01 17:30:17,+0530,,"Ship fast, scale faster 💨  ⚡️ Ankr offers a Premium RPC service for Web3 projects that are looking for fast and reliable infrastructure to scale operations to the next level.  Learn more about our Premium Pay as You Go model 👇  https://t.co/iqqMwdi3bH  https://t.co/ALLidn2ddX",en,[],[],1010430329218371584,1010430329218371584,ankr,Ankr,4,17,https://twitter.com/ankr/status/1598285855864520705,['https://www.ankr.com/rpc/pricing/#premiumBlock'],['https://pbs.twimg.com/media/Fi5Af7AWIAElXsu.jpg'],1,https://pbs.twimg.com/media/Fi5Af7AWIAElXsu.jpg,False,84,3,18,,None,,,,,,,[],,,,
38,1598044999102631936,1598044997361995777,1669838592000.0,2022-12-01 01:33:12,+0530,,2/ Read our latest blog article to understand Ankr’s IP Address Policy &amp; Your Privacy 👇  https://t.co/El0r79sntt,en,[],[],1010430329218371584,1010430329218371584,ankr,Ankr,4,01,https://twitter.com/ankr/status/1598044999102631936,['https://www.ankr.com/blog/ankrs-ip-address-policy-and-your-privacy/'],[],0,,False,32,3,2,,None,,,,,,,[],,,,
39,1598044997361995777,1598044997361995777,1669838592000.0,2022-12-01 01:33:12,+0530,,Ankr’s goal is to provide the best possible blockchain connection experience for our builders and users 🤝  🔒 Including an emphasis on best-in-class delivery as well as protecting user privacy,en,[],[],1010430329218371584,1010430329218371584,ankr,Ankr,4,01,https://twitter.com/ankr/status/1598044997361995777,[],[],0,,False,102,16,14,,None,,,,,,,[],,,,
40,1597985052675420162,1597985052675420162,1669824300000.0,2022-11-30 21:35:00,+0530,,🥁🥁🥁…  🥳 Congratulations @theoutdatedsoul!  Shoot us a DM to redeem your prize 📬🫡,en,[],[],1010430329218371584,1010430329218371584,ankr,Ankr,3,21,https://twitter.com/ankr/status/1597985052675420162,[],[],0,,False,72,8,10,https://twitter.com/ankr/status/1595104379560132611,None,,,,,,,[],,,,
41,1597976245979021313,1597976245979021313,1669822200000.0,2022-11-30 21:00:00,+0530,,Looking to build your own blockchain? 👀  ⚡️ Launch your own blockchain and list your token 10x faster with Ankr’s AppChains  More information below 👇  https://t.co/j9MiJlyxhZ  https://t.co/Nn7FtkHsPR,en,[],[],1010430329218371584,1010430329218371584,ankr,Ankr,3,21,https://twitter.com/ankr/status/1597976245979021313,['https://www.ankr.com/app-chains/'],['https://pbs.twimg.com/media/Fiz-XmiWYAAQy2a.jpg'],1,https://pbs.twimg.com/media/Fiz-XmiWYAAQy2a.jpg,False,73,3,15,,None,,,,,,,[],,,,
42,1597953721396334595,1597953721396334595,1669816830000.0,2022-11-30 19:30:30,+0530,,"Our Advanced APIs are designed to streamline #Web3 app development and operations by making the blockchain data you need faster, easier and more cost-efficient to retrieve 🫡  Learn more about using Advanced APIs:  https://t.co/AbpnTMzv6q.  https://t.co/PVrwThAFwr",en,['web3'],[],1010430329218371584,1010430329218371584,ankr,Ankr,3,19,https://twitter.com/ankr/status/1597953721396334595,['https://www.ankr.com/rpc/multichain'],['https://pbs.twimg.com/media/Fi0SbJuWAAEmBll.jpg'],1,https://pbs.twimg.com/media/Fi0SbJuWAAEmBll.jpg,False,69,4,9,,None,,,,,,,[],,,,
43,1597908332836261892,1597908332836261892,1669806008000.0,2022-11-30 16:30:08,+0530,,✍️  Dev tutorial alert!  How to Query cryptocurrencies by ⛓  using Ankr’s Advanced Token API?  Learn how to fetch the list of cryptocurrencies launched on a particular Blockchain using Ankr’s Token API 👇  https://t.co/keAHBBl5Ty,en,[],[],1010430329218371584,1010430329218371584,ankr,Ankr,3,16,https://twitter.com/ankr/status/1597908332836261892,['https://ankr.hashnode.dev/fetch-the-list-of-cryptocurrencies-launched-on-a-particular-blockchain-using-ankrs-token-api'],[],0,,False,63,12,16,,None,,,,,,,[],,,,
44,1597906525968035841,1597878147583803398,1669805578000.0,2022-11-30 16:22:58,+0530,,@CryptoNick_1 🤣,und,[],[],1010430329218371584,1010430329218371584,ankr,Ankr,3,16,https://twitter.com/ankr/status/1597906525968035841,[],[],0,,False,1,1,0,,None,,,,,,,"[{'screen_name': 'CryptoNick_1', 'name': 'CryptoNick', 'id': '1429458433913262082'}]",,,,
45,1597906443533189122,1597878147583803398,1669805558000.0,2022-11-30 16:22:38,+0530,,@BullsAnkr ☀️🫡,und,[],[],1010430329218371584,1010430329218371584,ankr,Ankr,3,16,https://twitter.com/ankr/status/1597906443533189122,[],[],0,,False,6,1,0,,None,,,,,,,"[{'screen_name': 'BullsAnkr', 'name': 'Ankr Bulls 🐂', 'id': '1337773332461092865'}]",,,,
46,1597878147583803398,1597878147583803398,1669798812000.0,2022-11-30 14:30:12,+0530,,gm ✨ ☕️  say it back 🫡,en,[],[],1010430329218371584,1010430329218371584,ankr,Ankr,3,14,https://twitter.com/ankr/status/1597878147583803398,[],[],0,,False,95,38,5,,None,,,,,,,[],,,,
47,1597597896714903552,1597597896714903552,1669731995000.0,2022-11-29 19:56:35,+0530,,"⚡️ It’s #giveaway time!  Switch to Ankr’s customised RPC on your @MetaMask for a chance to win $1,000 in $ANKR split between 10 winners 🔥👀  📋 Rules: 🖼 Switch your MetaMask RPC &amp; send a screenshot of it below 🔁 RT this post  📅 Ends: December 5th   https://t.co/pFp03wwvvG",en,['giveaway'],['ankr'],1010430329218371584,1010430329218371584,ankr,Ankr,2,19,https://twitter.com/ankr/status/1597597896714903552,['https://www.ankr.com/docs/rpc-service/chains/chains-api/ethereum/how-to/connect-metamask/'],[],0,,False,235,291,279,https://twitter.com/ankr/status/1597561171216777219,None,,,,,,,[],,,,
48,1597561196185387008,1597561171216777219,1669723245000.0,2022-11-29 17:30:45,+0530,,"6/ To learn more, head over to the link below 👇   https://t.co/pFp03wNyxG",en,[],[],1010430329218371584,1010430329218371584,ankr,Ankr,2,17,https://twitter.com/ankr/status/1597561196185387008,['https://www.ankr.com/docs/rpc-service/chains/chains-api/ethereum/how-to/connect-metamask/'],[],0,,False,28,1,5,,None,,,,,,,[],,,,
49,1597561193408839680,1597561171216777219,1669723244000.0,2022-11-29 17:30:44,+0530,,"5/ What about Ethereum Testnets? 🤔  Don't worry, we got it covered too.  You can also add Ankr Goerli RPC to your wallet 😉",en,[],[],1010430329218371584,1010430329218371584,ankr,Ankr,2,17,https://twitter.com/ankr/status/1597561193408839680,[],[],0,,False,31,2,3,,None,,,,,,,[],,,,
50,1597561190229585922,1597561171216777219,1669723243000.0,2022-11-29 17:30:43,+0530,,4/ Ignore the Chain ID warning and click Save ✔  https://t.co/ZKPrWAGo5F,en,[],[],1010430329218371584,1010430329218371584,ankr,Ankr,2,17,https://twitter.com/ankr/status/1597561190229585922,[],['https://pbs.twimg.com/media/FiutbolVQAIgkg1.jpg'],1,https://pbs.twimg.com/media/FiutbolVQAIgkg1.jpg,False,38,3,2,,None,,,,,,,[],,,,
51,1597561181618638848,1597561171216777219,1669723241000.0,2022-11-29 17:30:41,+0530,,3/ Open your @MetaMask account and select Add Network and add the details below ⬇️  https://t.co/IcKNZs5glq,en,[],[],1010430329218371584,1010430329218371584,ankr,Ankr,2,17,https://twitter.com/ankr/status/1597561181618638848,[],['https://pbs.twimg.com/media/FiutbTDVsAAgtLy.png'],1,https://pbs.twimg.com/media/FiutbTDVsAAgtLy.png,False,42,2,5,,None,,,,,,,[],,,,
52,1597561175654379520,1597561171216777219,1669723240000.0,2022-11-29 17:30:40,+0530,,2/ First let's break down how to add Ethereum Mainnet to your wallet 🫡,en,[],[],1010430329218371584,1010430329218371584,ankr,Ankr,2,17,https://twitter.com/ankr/status/1597561175654379520,[],[],0,,False,31,2,2,,None,,,,,,,[],,,,
53,1597561171216777219,1597561171216777219,1669723239000.0,2022-11-29 17:30:39,+0530,,🛠️ Configure a customized RPC to your MetaMask — now!  Plug with @Ankr’s distributed and high-performance ⚡ connections in a matter of no time.  Here's a simple step-by-step guide to connecting a MetaMask wallet to Ethereum Mainnet and Testnet 🐾  A 🧵👇  https://t.co/88VGi8Twyb,en,[],[],1010430329218371584,1010430329218371584,ankr,Ankr,2,17,https://twitter.com/ankr/status/1597561171216777219,[],['https://pbs.twimg.com/media/FiutahEVQAAyJpI.jpg'],1,https://pbs.twimg.com/media/FiutahEVQAAyJpI.jpg,False,465,86,101,,None,,,,,,,[],,,,
54,1597343825147891712,1597342205731299328,1669671419000.0,2022-11-29 03:06:59,+0530,,@SacramentoKings 🥳🏀,und,[],[],1010430329218371584,1010430329218371584,ankr,Ankr,2,03,https://twitter.com/ankr/status/1597343825147891712,[],[],0,,False,3,1,1,,None,,,,,,,"[{'screen_name': 'SacramentoKings', 'name': 'Sacramento Kings', 'id': '667563'}]",,,,
55,1597219559898947584,1597219559898947584,1669641792000.0,2022-11-28 18:53:12,+0530,,"Want to boost your DeFi yields? 👀  🥩 @ankrstaking provides the most flexible way to stake  Your assets are immediately liquid so you can use or trade them instantly, or unstake them to redeem your original assets 💧  Learn more:  https://t.co/N6RjZOtUYH",en,[],[],1010430329218371584,1010430329218371584,ankr,Ankr,1,18,https://twitter.com/ankr/status/1597219559898947584,['https://www.ankr.com/about-staking/'],[],0,,False,56,5,12,,None,,,,,,,[],,,,
