,id,conversation_id,created_at,date,timezone,place,tweet,language,hashtags,cashtags,user_id,user_id_str,username,name,day,hour,link,urls,photos,video,thumbnail,retweet,nlikes,nreplies,nretweets,quote_url,search,near,geo,source,user_rt_id,user_rt,retweet_id,reply_to,retweet_date,translate,trans_src,trans_dest
0,1599769455122608132,1599769455122608132,1670249735000.0,2022-12-05 19:45:35,+0530,,"Just a few hours until you can learn more about the significance of #crypto compliance, clear regulatory frameworks, and more. Be sure to tune in at 1 p.m. EST.",en,['crypto'],[],1508671012098904069,1508671012098904069,BobbyZagotta,Bobby Zagotta,1,19,https://twitter.com/BobbyZagotta/status/1599769455122608132,[],[],0,,False,5,0,1,https://twitter.com/Bitstamp/status/1598799198404714498,None,,,,,,,[],,,,
1,1597711894441140224,1597711894441140224,1669759174000.0,2022-11-30 03:29:34,+0530,,"I'll be speaking on everything you need to know about global market modernization at @Benzinga FinTech Deal Day, alongside Jarrod Yuster, @bhyndman, and @whessert.  Join us next Thursday at 12 p.m. ET in New York! #FinTech #Finance  https://t.co/OUgxgyoCKI",en,"['fintech', 'finance']",[],1508671012098904069,1508671012098904069,BobbyZagotta,Bobby Zagotta,3,03,https://twitter.com/BobbyZagotta/status/1597711894441140224,[],['https://pbs.twimg.com/media/Fiw2CIQXoAMb1gZ.jpg'],1,https://pbs.twimg.com/media/Fiw2CIQXoAMb1gZ.jpg,False,9,3,5,,None,,,,,,,[],,,,
2,1595492200841940995,1595492200841940995,1669229958000.0,2022-11-24 00:29:18,+0530,,I had the opportunity to sit down with @MichaelTBaer at @money2020 to discuss how @Bitstamp is working to educate the #crypto community in current market conditions.  Listen to the full episode here:  https://t.co/17sStX6Vjt,en,['crypto'],[],1508671012098904069,1508671012098904069,BobbyZagotta,Bobby Zagotta,4,00,https://twitter.com/BobbyZagotta/status/1595492200841940995,['https://open.spotify.com/episode/3GrZAQdl2UucxFReSLCZuN'],[],0,,False,3,0,0,,None,,,,,,,[],,,,
3,1595100529621078018,1595100529621078018,1669136576000.0,2022-11-22 22:32:56,+0530,,"I’m slowly brushing up on my Fall Guys skills, but I’m definitely no stranger to crypto.  Always happy to educate people on all things digital assets and FAQs surrounding the industry. Thank you @luxxbunny and @Immortals for having me!",en,[],[],1508671012098904069,1508671012098904069,BobbyZagotta,Bobby Zagotta,2,22,https://twitter.com/BobbyZagotta/status/1595100529621078018,[],[],0,,False,7,2,1,https://twitter.com/Immortals/status/1594829258123137024,None,,,,,,,[],,,,
4,1593728169646891010,1593727981096423425,1668809380000.0,2022-11-19 03:39:40,+0530,,"I spoke with @Mat_CH_IND, @AshBennington, and @jeremyvarlow this morning on @RealVision about the FTX chain of events that has stunned the industry and how we can move forward.  Thank you for having me!   https://t.co/8WmvSTCISa",en,[],[],1508671012098904069,1508671012098904069,BobbyZagotta,Bobby Zagotta,6,03,https://twitter.com/BobbyZagotta/status/1593728169646891010,['https://www.realvision.com/shows/crypto-daily-briefing/videos/new-ceo-ray-ftx-beats-enron-s-bottom-Qp58?tab=details'],[],0,,False,9,3,0,,None,,,,,,,[],,,,
5,1593727981096423425,1593727981096423425,1668809335000.0,2022-11-19 03:38:55,+0530,,"The crypto industry has a lot of work to do to regain trust, as well as work with regulators to provide the clarity and transparency that institutional and retail investors deserve.",en,[],[],1508671012098904069,1508671012098904069,BobbyZagotta,Bobby Zagotta,6,03,https://twitter.com/BobbyZagotta/status/1593727981096423425,[],[],0,,False,12,2,3,,None,,,,,,,[],,,,
6,1592635831885307909,1592635735387275265,1668548946000.0,2022-11-16 03:19:06,+0530,,The Lummis-Gillibrand bill would help provide the type of clarity that encourages companies to innovate here in the US rather than pushing them abroad.,en,[],[],1508671012098904069,1508671012098904069,BobbyZagotta,Bobby Zagotta,3,03,https://twitter.com/BobbyZagotta/status/1592635831885307909,[],[],0,,False,1,0,0,,None,,,,,,,[],,,,
7,1592635735387275265,1592635735387275265,1668548923000.0,2022-11-16 03:18:43,+0530,,"Excellent points @SenLummis.  These are the benefits that users in our industry deserve, and we can only get that if we get the clarity we’ve been asking for.",en,[],[],1508671012098904069,1508671012098904069,BobbyZagotta,Bobby Zagotta,3,03,https://twitter.com/BobbyZagotta/status/1592635735387275265,[],[],0,,False,3,1,0,https://twitter.com/SenLummis/status/1592212987259281408,None,,,,,,,[],,,,
8,1592527334305071105,1592527334305071105,1668523078000.0,2022-11-15 20:07:58,+0530,,"At Bitstamp 29% of the whole team - 180 people - have roles in compliance, regulation, legal, risk management or internal audit.  A safe exchange invests in teams to protect customers.  Learn more about what a safe exchange looks like  https://t.co/qRQCAvDqKb #Transparency #crypto",en,"['transparency', 'crypto']",[],1508671012098904069,1508671012098904069,BobbyZagotta,Bobby Zagotta,2,20,https://twitter.com/BobbyZagotta/status/1592527334305071105,['http://bit.ly/3O5vXo4'],[],0,,False,94,22,26,,None,,,,,,,[],,,,
9,1591088045545037824,1591086540079263744,1668179925000.0,2022-11-11 20:48:45,+0530,,"If you have any questions or concerns, our 24/7 customer support is available anytime and anywhere.",en,[],[],1508671012098904069,1508671012098904069,BobbyZagotta,Bobby Zagotta,5,20,https://twitter.com/BobbyZagotta/status/1591088045545037824,[],[],0,,False,10,7,2,,None,,,,,,,[],,,,
10,1591087955116163072,1591086540079263744,1668179904000.0,2022-11-11 20:48:24,+0530,,"Over the years we’ve built up trust - through proven experience - among retail and institutional investors. In fact, our market-leading insurance coverage is one of the many ways we work to ensure our customers' trust that their funds are safe with us.",en,[],[],1508671012098904069,1508671012098904069,BobbyZagotta,Bobby Zagotta,5,20,https://twitter.com/BobbyZagotta/status/1591087955116163072,[],[],0,,False,5,1,0,,None,,,,,,,[],,,,
11,1591087690661113859,1591086540079263744,1668179841000.0,2022-11-11 20:47:21,+0530,,"In addition, Bitstamp is audited by one of the Big Four accounting firms annually, and we have a proof of reserves initiative underway.",en,[],[],1508671012098904069,1508671012098904069,BobbyZagotta,Bobby Zagotta,5,20,https://twitter.com/BobbyZagotta/status/1591087690661113859,[],[],0,,False,5,1,0,,None,,,,,,,[],,,,
12,1591087627314552833,1591086540079263744,1668179825000.0,2022-11-11 20:47:05,+0530,,"We have an expansive regulatory footprint in the U.S. underpinned by our Bitlicense in New York, as well as numerous other licenses around the globe.",en,[],[],1508671012098904069,1508671012098904069,BobbyZagotta,Bobby Zagotta,5,20,https://twitter.com/BobbyZagotta/status/1591087627314552833,[],[],0,,False,4,1,0,,None,,,,,,,[],,,,
13,1591087115798188032,1591086540079263744,1668179704000.0,2022-11-11 20:45:04,+0530,,"Since 2011, Bitstamp has served customers with transparency and an unwavering focus on compliance and fund security.  Bitstamp is widely known to be the most proactive and compliance-forward crypto exchange on the planet.",en,[],[],1508671012098904069,1508671012098904069,BobbyZagotta,Bobby Zagotta,5,20,https://twitter.com/BobbyZagotta/status/1591087115798188032,[],[],0,,False,5,1,0,,None,,,,,,,[],,,,
14,1591086792253779969,1591086540079263744,1668179626000.0,2022-11-11 20:43:46,+0530,,Customer funds are held 1:1 in custody or bank accounts and are never lent or repurposed without the customer’s instruction.,en,[],[],1508671012098904069,1508671012098904069,BobbyZagotta,Bobby Zagotta,5,20,https://twitter.com/BobbyZagotta/status/1591086792253779969,[],[],0,,False,6,1,0,,None,,,,,,,[],,,,
15,1591086698032947201,1591086540079263744,1668179604000.0,2022-11-11 20:43:24,+0530,,"I want to reassure our customers that we have no exposure to FTX or Alameda Research.   At Bitstamp, customer funds are always safe and held separately from corporate funds.",en,[],[],1508671012098904069,1508671012098904069,BobbyZagotta,Bobby Zagotta,5,20,https://twitter.com/BobbyZagotta/status/1591086698032947201,[],[],0,,False,4,2,0,,None,,,,,,,[],,,,
16,1591086540079263744,1591086540079263744,1668179566000.0,2022-11-11 20:42:46,+0530,,"The recent events at FTX and the aftermath faced by its customers are tough to see. I sympathize with everyone affected, and my hope is that we can all work together to move forward.",en,[],[],1508671012098904069,1508671012098904069,BobbyZagotta,Bobby Zagotta,5,20,https://twitter.com/BobbyZagotta/status/1591086540079263744,[],[],0,,False,33,8,5,,None,,,,,,,[],,,,
17,1590801461608599552,1590801461608599552,1668111598000.0,2022-11-11 01:49:58,+0530,,"At @Bitstamp, we’ve always prioritized compliance as well as the safety and security of our customers' assets.  Today, I discussed the various ways we work to ensure transparency and trust with @CNBC:  https://t.co/OXTjqemrLS",en,[],[],1508671012098904069,1508671012098904069,BobbyZagotta,Bobby Zagotta,5,01,https://twitter.com/BobbyZagotta/status/1590801461608599552,['https://www.cnbc.com/video/2022/11/10/im-comfortable-cryptocurrencies-can-be-custodied-safely-and-securely-says-bitstamp-usa-ceo.html?&qsearchterm=Robert%20Zagotta'],[],0,,False,46,15,15,,None,,,,,,,[],,,,
18,1589742036265373696,1589742036265373696,1667859012000.0,2022-11-08 03:40:12,+0530,,I’m back with @luxxbunny tonight at 7 PM ET for an #AMA!  Join us as we play Fall Guys (correction: Luxx plays and I fall) and answer some FAQs around digital assets.   https://t.co/yE1CXHgAem,en,['ama'],[],1508671012098904069,1508671012098904069,BobbyZagotta,Bobby Zagotta,2,03,https://twitter.com/BobbyZagotta/status/1589742036265373696,['https://www.twitch.tv/luxx'],[],0,,False,3,4,2,,None,,,,,,,[],,,,
19,1588551775975796736,1588551679838162946,1667575231000.0,2022-11-04 20:50:31,+0530,,"Our Crypto Pulse survey found that the number of people who trust crypto is much higher than you'd expect from mainstream media, but some people who want to participate in crypto don't know where to start.",en,[],[],1508671012098904069,1508671012098904069,BobbyZagotta,Bobby Zagotta,5,20,https://twitter.com/BobbyZagotta/status/1588551775975796736,[],[],0,,False,0,1,0,,None,,,,,,,[],,,,
