,id,conversation_id,created_at,date,timezone,place,tweet,language,hashtags,cashtags,user_id,user_id_str,username,name,day,hour,link,urls,photos,video,thumbnail,retweet,nlikes,nreplies,nretweets,quote_url,search,near,geo,source,user_rt_id,user_rt,retweet_id,reply_to,retweet_date,translate,trans_src,trans_dest
0,1599835629973516288,1599835629973516288,1670265512000.0,2022-12-06 00:08:32,+0530,,Once you become a sayer and hold yourself accountable.  Your words become true like magic.,en,[],[],1539396470922792961,1539396470922792961,Morpheusresist,Andrew Tate Updates,2,00,https://twitter.com/Morpheusresist/status/1599835629973516288,[],[],0,,False,395,8,38,,None,,,,,,,[],,,,
1,1599760127867097089,1599760127867097089,1670247511000.0,2022-12-05 19:08:31,+0530,,GM  https://t.co/ONfHmnuNBv,und,[],[],1539396470922792961,1539396470922792961,Morpheusresist,Andrew Tate Updates,1,19,https://twitter.com/Morpheusresist/status/1599760127867097089,[],[],1,https://pbs.twimg.com/ext_tw_video_thumb/1599760072518819847/pu/img/qyCJNYoAcfkqklht.jpg,False,308,12,1,,None,,,,,,,[],,,,
2,1599497279450206208,1599497279450206208,1670184843000.0,2022-12-05 01:44:03,+0530,,Despite growing up poor -   I find myself harboring disdain for the financially underachieved.   You’re not trying.  I would know. I started below you.  Now I’m in the top 0.01% of this planet.  There is no such thing as trying and failing for 10 years.,en,[],[],1539396470922792961,1539396470922792961,Morpheusresist,Andrew Tate Updates,1,01,https://twitter.com/Morpheusresist/status/1599497279450206208,[],[],0,,False,745,27,34,,None,,,,,,,[],,,,
3,1599440407015792640,1599440407015792640,1670171283000.0,2022-12-04 21:58:03,+0530,,"There is no such thing as ""sad""  You are either content and happy where you are.  Or you are furiously motivated to change something.  Either OR. BLACK AND WHITE.  Ying and Yang.  Act.",en,[],[],1539396470922792961,1539396470922792961,Morpheusresist,Andrew Tate Updates,7,21,https://twitter.com/Morpheusresist/status/1599440407015792640,[],[],0,,False,745,15,80,,None,,,,,,,[],,,,
4,1599368589080899585,1599368589080899585,1670154161000.0,2022-12-04 17:12:41,+0530,,GM  https://t.co/dF6XkjRs2y,und,[],[],1539396470922792961,1539396470922792961,Morpheusresist,Andrew Tate Updates,7,17,https://twitter.com/Morpheusresist/status/1599368589080899585,[],['https://pbs.twimg.com/media/FjIZQBJXwAYNwgh.jpg'],1,https://pbs.twimg.com/media/FjIZQBJXwAYNwgh.jpg,False,1598,22,29,,None,,,,,,,[],,,,
5,1599152216895815680,1599152216895815680,1670102573000.0,2022-12-04 02:52:53,+0530,,"Everything you ARE stems from what you've experienced.  It's an unstoppable force like Gravity.  You cannot stop the programming but, YOU can be CHOOSE what you hear and experience.  You can choose WHAT and WHO programs your mind.",en,[],[],1539396470922792961,1539396470922792961,Morpheusresist,Andrew Tate Updates,7,02,https://twitter.com/Morpheusresist/status/1599152216895815680,[],[],0,,False,400,8,31,,None,,,,,,,[],,,,
6,1599099210640502784,1599099210640502784,1670089936000.0,2022-12-03 23:22:16,+0530,,"Too many of you value money.  As if money will save you from yourself.  Every one of you reading this should be focusing ENTIRELY on changing who you are as a man.  You are where you deserve to be, and no amount of money will change who you are.",en,[],[],1539396470922792961,1539396470922792961,Morpheusresist,Andrew Tate Updates,6,23,https://twitter.com/Morpheusresist/status/1599099210640502784,[],[],0,,False,980,17,121,,None,,,,,,,[],,,,
7,1599025383793270791,1599025383793270791,1670072334000.0,2022-12-03 18:28:54,+0530,,"The most dangerous men are always nice.   Until you piss them off.   That’s where the line is drawn.   I absolutely cannot be trifled with by any normal man in this country.   Outside of the 0.1%. If I get in people’s way, they move.   I don’t abuse it. But it’s absolutely true.",en,[],[],1539396470922792961,1539396470922792961,Morpheusresist,Andrew Tate Updates,6,18,https://twitter.com/Morpheusresist/status/1599025383793270791,[],[],0,,False,992,12,103,,None,,,,,,,[],,,,
8,1598723533407911937,1598723533407911937,1670000367000.0,2022-12-02 22:29:27,+0530,,Geeks can only advise you on how to be geeks.  99% of people are geeks.  Don't listen to them.,en,[],[],1539396470922792961,1539396470922792961,Morpheusresist,Andrew Tate Updates,5,22,https://twitter.com/Morpheusresist/status/1598723533407911937,[],[],0,,False,783,16,59,,None,,,,,,,[],,,,
9,1598643763697549312,1598643763697549312,1669981349000.0,2022-12-02 17:12:29,+0530,,"The closer you get to the top echelons in life, the less you lie.  When you have no boss or co-workers, you lie less.  When you’re physically dangerous, you lie less.  The more little white lies you tell the lower you are on the food chain.  Rabbits talk nicely.  Tigers don’t.",en,[],[],1539396470922792961,1539396470922792961,Morpheusresist,Andrew Tate Updates,5,17,https://twitter.com/Morpheusresist/status/1598643763697549312,[],[],0,,False,1326,17,164,,None,,,,,,,[],,,,
10,1598447058284957704,1598447058284957704,1669934451000.0,2022-12-02 04:10:51,+0530,,Life is all about you.  But not at all about you.  Those are two opposing thoughts.  Yet both of them are true.  Do you understand?,en,[],[],1539396470922792961,1539396470922792961,Morpheusresist,Andrew Tate Updates,5,04,https://twitter.com/Morpheusresist/status/1598447058284957704,[],[],0,,False,491,25,33,,None,,,,,,,[],,,,
11,1598402273041793024,1598402273041793024,1669923773000.0,2022-12-02 01:12:53,+0530,,"If you have the human capability to LISTEN, LEARN and WORK.   If you understand that there is a level of human existence that very few people get to experience.    If you are ready to burn the boats.    IF YOU ARE READY TO BE UNPLUGGED.    Then you are as ready as possible.",en,[],[],1539396470922792961,1539396470922792961,Morpheusresist,Andrew Tate Updates,5,01,https://twitter.com/Morpheusresist/status/1598402273041793024,[],[],0,,False,285,4,19,,None,,,,,,,[],,,,
12,1598303490438225923,1598303490438225923,1669900221000.0,2022-12-01 18:40:21,+0530,,Guess whose birthday it is today 😁  https://t.co/G1juFCzQhd,en,[],[],1539396470922792961,1539396470922792961,Morpheusresist,Andrew Tate Updates,4,18,https://twitter.com/Morpheusresist/status/1598303490438225923,[],['https://pbs.twimg.com/media/Fi5QjLXWIAESzZk.jpg'],1,https://pbs.twimg.com/media/Fi5QjLXWIAESzZk.jpg,False,2737,114,56,,None,,,,,,,[],,,,
13,1598286638064754688,1598286638064754688,1669896203000.0,2022-12-01 17:33:23,+0530,,Why it is crucial for men to become competent for their own sake  Watch the full interview here:  https://t.co/WhToo8xHq9  https://t.co/rTmPGJYEA3,en,[],[],1539396470922792961,1539396470922792961,Morpheusresist,Andrew Tate Updates,4,17,https://twitter.com/Morpheusresist/status/1598286638064754688,['https://rumble.com/v1ub9j0-andrew-tate-talks-fighting-the-matrix-and-cancel-culture-masculinity-and-mo.html'],[],1,https://pbs.twimg.com/ext_tw_video_thumb/1598286536679866368/pu/img/YQRSEB0UBWlgJIbI.jpg,False,387,6,42,,None,,,,,,,[],,,,
14,1598174384975642624,1598174384975642624,1669869440000.0,2022-12-01 10:07:20,+0530,,Love is the universal driving force for hate.  Hatred for something is born from love of something else.  You hate the rain because you love the sunshine.  Do you understand?,en,[],[],1539396470922792961,1539396470922792961,Morpheusresist,Andrew Tate Updates,4,10,https://twitter.com/Morpheusresist/status/1598174384975642624,[],[],0,,False,546,30,46,,None,,,,,,,[],,,,
15,1598056014669967360,1598056014669967360,1669841218000.0,2022-12-01 02:16:58,+0530,,Resist the slave mind.   https://t.co/z8MPXGkupz,en,[],[],1539396470922792961,1539396470922792961,Morpheusresist,Andrew Tate Updates,4,02,https://twitter.com/Morpheusresist/status/1598056014669967360,['http://bit.ly/resistslavery'],[],0,,False,197,11,10,,None,,,,,,,[],,,,
16,1597992386705358849,1597992386705358849,1669826048000.0,2022-11-30 22:04:08,+0530,,"Hold a bone infront of a dog.  See that laser focus?  See how NOTHING ELSE matters?  Dogs are OBJECTIVE focused.  If you could do the same thing, for only a few hours a day.  You'd have everything you've ever wanted.",en,[],[],1539396470922792961,1539396470922792961,Morpheusresist,Andrew Tate Updates,3,22,https://twitter.com/Morpheusresist/status/1597992386705358849,[],[],0,,False,978,13,123,,None,,,,,,,[],,,,
17,1597918396162912257,1597918396162912257,1669808408000.0,2022-11-30 17:10:08,+0530,,When rich people say money isn’t important to be happy it isn’t virtuous.   It’s a “fuck you” to poor people.   Everybody knows money is massively important and the rich person won’t give his away.   Imagine a fat man telling a starving child   “Food isn’t important to be happy”,en,[],[],1539396470922792961,1539396470922792961,Morpheusresist,Andrew Tate Updates,3,17,https://twitter.com/Morpheusresist/status/1597918396162912257,[],[],0,,False,1120,23,147,,None,,,,,,,[],,,,
18,1597751788404629504,1597751788404629504,1669768685000.0,2022-11-30 06:08:05,+0530,, https://t.co/Nrk7P34LlO,zxx,[],[],1539396470922792961,1539396470922792961,Morpheusresist,Andrew Tate Updates,3,06,https://twitter.com/Morpheusresist/status/1597751788404629504,[],"['https://pbs.twimg.com/media/FixaxtAXkAAsu0K.jpg', 'https://pbs.twimg.com/media/FixaxtMX0AAI6SG.jpg', 'https://pbs.twimg.com/media/Fixaxs9XoAEJjVx.jpg']",1,https://pbs.twimg.com/media/FixaxtAXkAAsu0K.jpg,False,4880,50,141,,None,,,,,,,[],,,,
19,1597682005562781696,1597682005562781696,1669752048000.0,2022-11-30 01:30:48,+0530,,The world is full of evil.   Parked right next door to the marshmallows and rainbows.   You’re conditioned to ignore it.   But it’s right there.,en,[],[],1539396470922792961,1539396470922792961,Morpheusresist,Andrew Tate Updates,3,01,https://twitter.com/Morpheusresist/status/1597682005562781696,[],[],0,,False,671,8,60,,None,,,,,,,[],,,,
20,1597639702601162752,1597639702601162752,1669741962000.0,2022-11-29 22:42:42,+0530,,How to spot a Pedophile  Watch now:  https://t.co/Cq9zBFWvyo  https://t.co/IzDlm1DkYb,en,[],[],1539396470922792961,1539396470922792961,Morpheusresist,Andrew Tate Updates,2,22,https://twitter.com/Morpheusresist/status/1597639702601162752,['https://rumble.com/v1xvu3w-how-to-spot-a-paedophile.html'],['https://pbs.twimg.com/media/Fiv01xeXoAEEPE2.jpg'],1,https://pbs.twimg.com/media/Fiv01xeXoAEEPE2.jpg,False,846,19,75,,None,,,,,,,[],,,,
21,1597305227874816000,1597305227874816000,1669662217000.0,2022-11-29 00:33:37,+0530,, https://t.co/sfxQ6csvJH,zxx,[],[],1539396470922792961,1539396470922792961,Morpheusresist,Andrew Tate Updates,2,00,https://twitter.com/Morpheusresist/status/1597305227874816000,[],"['https://pbs.twimg.com/media/FirEoj9XoAAVXLh.jpg', 'https://pbs.twimg.com/media/FirEoj9XwAIwGzM.jpg', 'https://pbs.twimg.com/media/FirEoj_WIAAspah.jpg', 'https://pbs.twimg.com/media/FirEoj7WYAEj2Fn.jpg']",1,https://pbs.twimg.com/media/FirEoj9XoAAVXLh.jpg,False,5403,98,187,,None,,,,,,,[],,,,
22,1597253218899140611,1597253218899140611,1669649817000.0,2022-11-28 21:06:57,+0530,, https://t.co/sDxQyPQrWR,zxx,[],[],1539396470922792961,1539396470922792961,Morpheusresist,Andrew Tate Updates,1,21,https://twitter.com/Morpheusresist/status/1597253218899140611,[],['https://pbs.twimg.com/media/FiqVVhdWQAgRfeo.jpg'],1,https://pbs.twimg.com/media/FiqVVhdWQAgRfeo.jpg,False,3197,65,460,,None,,,,,,,[],,,,
23,1597214180721176576,1597214180721176576,1669640510000.0,2022-11-28 18:31:50,+0530,,"You thought this was only about Balenciaga?  Here’s some more cookies in Disneys new movie “The Santa Clauses”  Soon, you will realize if not already, these “hidden messages” are in ALL the content you consume  https://t.co/nh8CfT0KyD",en,[],[],1539396470922792961,1539396470922792961,Morpheusresist,Andrew Tate Updates,1,18,https://twitter.com/Morpheusresist/status/1597214180721176576,[],['https://pbs.twimg.com/media/Fipx1JLX0AsaNgR.jpg'],1,https://pbs.twimg.com/media/Fipx1JLX0AsaNgR.jpg,False,26585,694,6107,,None,,,,,,,[],,,,
24,1597047479564140546,1597047479564140546,1669600765000.0,2022-11-28 07:29:25,+0530,,"This young man had stage 4 cancer,  “Then Andrew Tate came out of nowhere and inspired me”  Isn’t it amazing, the power of belief.  You “accepted” the outcome,  But there was a shift, you began to believe.  YOU did that.  Keep burning bright, young man. ❤️💪🏻  https://t.co/8esHO9nGFw",en,[],[],1539396470922792961,1539396470922792961,Morpheusresist,Andrew Tate Updates,1,07,https://twitter.com/Morpheusresist/status/1597047479564140546,[],[],1,https://pbs.twimg.com/ext_tw_video_thumb/1597047410873798656/pu/img/yh3N-fgPaV-k8SuC.jpg,False,5761,89,553,,None,,,,,,,[],,,,
25,1596993295372017664,1596993293069733889,1669587846000.0,2022-11-28 03:54:06,+0530,,The images above are from the (now private) account of the companies MAIN STYLIST.,en,[],[],1539396470922792961,1539396470922792961,Morpheusresist,Andrew Tate Updates,1,03,https://twitter.com/Morpheusresist/status/1596993295372017664,[],[],0,,False,379,6,22,,None,,,,,,,[],,,,
26,1596993293069733889,1596993293069733889,1669587846000.0,2022-11-28 03:54:06,+0530,,"Does anyone also see how no other celebrity who wanted to cancel @kanyewest for sharing his opinion  Is speaking out about the current situation?  Or as customs have it in their religion “you must defend and protect your own”  Cancel the Christian, but be silent against satanism",en,[],[],1539396470922792961,1539396470922792961,Morpheusresist,Andrew Tate Updates,1,03,https://twitter.com/Morpheusresist/status/1596993293069733889,[],[],0,,False,1289,36,216,https://twitter.com/jakeshieldsajj/status/1596982048387760129,None,,,,,,,[],,,,
27,1596985840286470146,1596985840286470146,1669586069000.0,2022-11-28 03:24:29,+0530,,Andrew Tate breaking down the Balenciaga situation for what it REALLY IS.  He also breaks down a satanic practice “they” use called “revelation of the method”.  https://t.co/JCrtg512lb,en,[],[],1539396470922792961,1539396470922792961,Morpheusresist,Andrew Tate Updates,1,03,https://twitter.com/Morpheusresist/status/1596985840286470146,[],[],1,https://pbs.twimg.com/ext_tw_video_thumb/1596985580067459075/pu/img/EldUkB5VXWUk5w2g.jpg,False,102431,2250,25827,,None,,,,,,,[],,,,
28,1596912207215763463,1596912207215763463,1669568514000.0,2022-11-27 22:31:54,+0530,,Step 1 - Inner circle of brothers you can rely on.  Step 2 - Endless work.   Step 3 - Win at life  Episode 3 of the Croatia Yacht trip coming soon.  https://t.co/WZ62QuUKB2,en,[],[],1539396470922792961,1539396470922792961,Morpheusresist,Andrew Tate Updates,7,22,https://twitter.com/Morpheusresist/status/1596912207215763463,[],[],1,https://pbs.twimg.com/ext_tw_video_thumb/1596912044078505992/pu/img/tQklJe1EgeMK6eaM.jpg,False,385,10,19,,None,,,,,,,[],,,,
29,1596851569164943360,1596851569164943360,1669554056000.0,2022-11-27 18:30:56,+0530,,I dig the well before I’m thirsty.  It’s going to be a lot harder to dig by the time you need it.,en,[],[],1539396470922792961,1539396470922792961,Morpheusresist,Andrew Tate Updates,7,18,https://twitter.com/Morpheusresist/status/1596851569164943360,[],[],0,,False,687,7,64,,None,,,,,,,[],,,,
30,1596657843477704704,1596657843477704704,1669507869000.0,2022-11-27 05:41:09,+0530,, https://t.co/ubMzeI4ESi,zxx,[],[],1539396470922792961,1539396470922792961,Morpheusresist,Andrew Tate Updates,7,05,https://twitter.com/Morpheusresist/status/1596657843477704704,[],['https://pbs.twimg.com/media/Fih32L5XEAI1_RU.jpg'],1,https://pbs.twimg.com/media/Fih32L5XEAI1_RU.jpg,False,37296,392,4458,,None,,,,,,,[],,,,
31,1596532886211264512,1596532886211264512,1669478076000.0,2022-11-26 21:24:36,+0530,,"Pain can teach.    If it doesn’t hurt much, you learn nothing.    If it hurts a lot, you learn something.    But some pain is absolutely devastating, it hits like a train &amp; destroys your ability to grow.    You don’t learn anything.    You simply suffer because it hurts too much.",en,[],[],1539396470922792961,1539396470922792961,Morpheusresist,Andrew Tate Updates,6,21,https://twitter.com/Morpheusresist/status/1596532886211264512,[],[],0,,False,474,11,48,,None,,,,,,,[],,,,
32,1596500950889660418,1596500950889660418,1669470462000.0,2022-11-26 19:17:42,+0530,,"Poor still? BLAME YOURSELF.  Your mind is infected.  You’re surrounded by weaklings, cowards and idiots.  The only true positive influence most of you have dragging you to the light is me.",en,[],[],1539396470922792961,1539396470922792961,Morpheusresist,Andrew Tate Updates,6,19,https://twitter.com/Morpheusresist/status/1596500950889660418,[],[],0,,False,735,11,69,,None,,,,,,,[],,,,
33,1596280056241967112,1596280056241967112,1669417797000.0,2022-11-26 04:39:57,+0530,, https://t.co/TTrwPcCT1E,zxx,[],[],1539396470922792961,1539396470922792961,Morpheusresist,Andrew Tate Updates,6,04,https://twitter.com/Morpheusresist/status/1596280056241967112,[],[],1,https://pbs.twimg.com/ext_tw_video_thumb/1596279946476982273/pu/img/nMXKoXq9hdnTteTw.jpg,False,580,12,13,,None,,,,,,,[],,,,
34,1596265383925010432,1596265383925010432,1669414299000.0,2022-11-26 03:41:39,+0530,, https://t.co/48RMMkOyO3,zxx,[],[],1539396470922792961,1539396470922792961,Morpheusresist,Andrew Tate Updates,6,03,https://twitter.com/Morpheusresist/status/1596265383925010432,[],[],1,https://pbs.twimg.com/ext_tw_video_thumb/1596265280161939456/pu/img/JohItI61z4zg9L-o.jpg,False,1750,36,212,,None,,,,,,,[],,,,
35,1596216137981001728,1596216137981001728,1669402558000.0,2022-11-26 00:25:58,+0530,,"“Died Suddenly”  Remember the Balenciaga situation;   the idea that “they” must SAY or SHOW what they are doing to negate Karmic retribution? And how silence is acceptance?  I want you to watch this clip and tell me, do you think the spike in “sudden deaths” is… natural?  https://t.co/tAzcvingBD",en,[],[],1539396470922792961,1539396470922792961,Morpheusresist,Andrew Tate Updates,6,00,https://twitter.com/Morpheusresist/status/1596216137981001728,[],[],1,https://pbs.twimg.com/ext_tw_video_thumb/1596215960549134337/pu/img/5PTgO3WYARm3O_oN.jpg,False,2078,63,548,,None,,,,,,,[],,,,
36,1596163181780549633,1596163175908806656,1669389932000.0,2022-11-25 20:55:32,+0530,,"Your friends and family teach you that it is OKAY to be a slave, that you should aspire to be a happy comfortable slave.  Which is FINE, they want the best for you and it is all they can teach you, it is the only thing they know.  I am here to tell you IT IS NOT.",en,[],[],1539396470922792961,1539396470922792961,Morpheusresist,Andrew Tate Updates,5,20,https://twitter.com/Morpheusresist/status/1596163181780549633,[],[],0,,False,120,2,7,,None,,,,,,,[],,,,
37,1596163179939520513,1596163175908806656,1669389932000.0,2022-11-25 20:55:32,+0530,,"You don’t want one, okay.  But COULD you?  If something clicked in your brain right now, COULD YOU?",en,[],[],1539396470922792961,1539396470922792961,Morpheusresist,Andrew Tate Updates,5,20,https://twitter.com/Morpheusresist/status/1596163179939520513,[],[],0,,False,95,3,3,,None,,,,,,,[],,,,
38,1596163177947213824,1596163175908806656,1669389931000.0,2022-11-25 20:55:31,+0530,,"MOST PEOPLE ARE SLAVES.  This is simply true.  If you are part of the 99.9%, you are a slave.  You may be comfortable, you may be happy, but that doesn’t change the fact, you are living a slave’s existence.  “I’m not a slave”  Could you buy a Bugatti right now?",en,[],[],1539396470922792961,1539396470922792961,Morpheusresist,Andrew Tate Updates,5,20,https://twitter.com/Morpheusresist/status/1596163177947213824,[],[],0,,False,98,3,3,,None,,,,,,,[],,,,
39,1596163175908806656,1596163175908806656,1669389931000.0,2022-11-25 20:55:31,+0530,,"You become who you surround yourself with.  This is an important law of the universe.  It is the same as gravity.  You can resist, but the pull is constant and unrelenting.  Some of you are SO used to being influenced toward slavery, you don’t even notice the pull.",en,[],[],1539396470922792961,1539396470922792961,Morpheusresist,Andrew Tate Updates,5,20,https://twitter.com/Morpheusresist/status/1596163175908806656,[],[],0,,False,731,10,86,,None,,,,,,,[],,,,
