,id,conversation_id,created_at,date,timezone,place,tweet,language,hashtags,cashtags,user_id,user_id_str,username,name,day,hour,link,urls,photos,video,thumbnail,retweet,nlikes,nreplies,nretweets,quote_url,search,near,geo,source,user_rt_id,user_rt,retweet_id,reply_to,retweet_date,translate,trans_src,trans_dest
0,1599894315018334210,1599894315018334210,1670279503000.0,2022-12-06 04:01:43,+0530,,This made me think back to last time I was in the bahamas not too long ago. That is SBF apartment over my right shoulder.  https://t.co/NR64V0UMTv,en,[],[],1444376487457603587,1444376487457603587,NorthRockLP,Hal Press,2,04,https://twitter.com/NorthRockLP/status/1599894315018334210,[],['https://pbs.twimg.com/media/FjP3Zf-WIAkFZKK.jpg'],1,https://pbs.twimg.com/media/FjP3Zf-WIAkFZKK.jpg,False,18,4,0,https://twitter.com/northrocklp/status/1599881296838287363,None,,,,,,,[],,,,
1,1599881296838287363,1599881296838287363,1670276400000.0,2022-12-06 03:10:00,+0530,,This winter weather is miserable. Already looking forward to the summer again so I can do more of this.  https://t.co/W8iUNAqSfj,en,[],[],1444376487457603587,1444376487457603587,NorthRockLP,Hal Press,2,03,https://twitter.com/NorthRockLP/status/1599881296838287363,[],['https://pbs.twimg.com/media/FjPriUOWYBYwzRN.jpg'],1,https://pbs.twimg.com/media/FjPriUOWYBYwzRN.jpg,False,25,6,0,,None,,,,,,,[],,,,
2,1599855679027625984,1599855679027625984,1670270292000.0,2022-12-06 01:28:12,+0530,,"All the leveraged longs that bought last night around 1300 flushed out again, and now shorts pressing at the lows. How many times we gonna go through this cycle lol.  https://t.co/FeP8HEpxCm",en,[],[],1444376487457603587,1444376487457603587,NorthRockLP,Hal Press,2,01,https://twitter.com/NorthRockLP/status/1599855679027625984,[],['https://pbs.twimg.com/media/FjPUITmXEAcIPbT.jpg'],1,https://pbs.twimg.com/media/FjPUITmXEAcIPbT.jpg,False,58,9,1,,None,,,,,,,[],,,,
3,1599823050073001985,1599492930288291841,1670262513000.0,2022-12-05 23:18:33,+0530,,@StephenCesaro Well the interesting thing is that wages are not a part of CPI. So of course there is a feed through but I can still see a scenario where CPI comes down a lot more than wages. Also I do think wages are just lagging and will start to moderate as well.,en,[],[],1444376487457603587,1444376487457603587,NorthRockLP,Hal Press,1,23,https://twitter.com/NorthRockLP/status/1599823050073001985,[],[],0,,False,1,1,0,,None,,,,,,,"[{'screen_name': 'StephenCesaro', 'name': 'STΞPHΞN 🌾', 'id': '994030034'}]",,,,
4,1599642530064216065,1599642530064216065,1670219473000.0,2022-12-05 11:21:13,+0530,,I think the reason some people think this is because they solely look at mega secular trends. In the short to medium term the mechanical factors (nuts and bolts of how CPI is calculated) are much more powerful and will overwhelm any secular forces.,en,[],[],1444376487457603587,1444376487457603587,NorthRockLP,Hal Press,1,11,https://twitter.com/NorthRockLP/status/1599642530064216065,[],[],0,,False,23,4,1,https://twitter.com/NorthRockLP/status/1599642033085624321,None,,,,,,,[],,,,
5,1599642035505442816,1599642033085624321,1670219355000.0,2022-12-05 11:19:15,+0530,,"Longer term, I do think think there is a legitimate question about why we adhere to an arbitrary number. But that's a topic for the future not now or anytime soon.",en,[],[],1444376487457603587,1444376487457603587,NorthRockLP,Hal Press,1,11,https://twitter.com/NorthRockLP/status/1599642035505442816,[],[],0,,False,23,2,0,,None,,,,,,,[],,,,
6,1599642033085624321,1599642033085624321,1670219355000.0,2022-12-05 11:19:15,+0530,,"The ""FED will have to change inflation target to 3.5%"" take is going to look silly in 6 months IMO. In 6 months there is a greater chance we'll be normalizing sub 2% than 3.5%.",en,[],[],1444376487457603587,1444376487457603587,NorthRockLP,Hal Press,1,11,https://twitter.com/NorthRockLP/status/1599642033085624321,[],[],0,,False,78,5,2,,None,,,,,,,[],,,,
7,1599640549895831552,1599628965810823168,1670219001000.0,2022-12-05 11:13:21,+0530,,@CL207 This sht not as easy as most on here would have you believe. Respect for being honest. Also I’m sure you’ll be just fine anyway lol.,en,[],[],1444376487457603587,1444376487457603587,NorthRockLP,Hal Press,1,11,https://twitter.com/NorthRockLP/status/1599640549895831552,[],[],0,,False,42,0,0,,None,,,,,,,"[{'screen_name': 'CL207', 'name': 'CL', 'id': '1073132650309726208'}]",,,,
8,1599629756240039936,1599629756240039936,1670216428000.0,2022-12-05 10:30:28,+0530,,Wall pulled....  https://t.co/bqKUyed1hv,en,[],[],1444376487457603587,1444376487457603587,NorthRockLP,Hal Press,1,10,https://twitter.com/NorthRockLP/status/1599629756240039936,[],['https://pbs.twimg.com/media/FjMGwhpXoAAYjuZ.png'],1,https://pbs.twimg.com/media/FjMGwhpXoAAYjuZ.png,False,42,8,1,https://twitter.com/NorthRockLP/status/1599595721954451457,None,,,,,,,[],,,,
9,1599620333329580033,1599615318535462914,1670214181000.0,2022-12-05 09:53:01,+0530,,"@napgener I think the trade has further to go, would agree with you, but think eventually will be a short, not sure when yet though",en,[],[],1444376487457603587,1444376487457603587,NorthRockLP,Hal Press,1,09,https://twitter.com/NorthRockLP/status/1599620333329580033,[],[],0,,False,5,0,0,,None,,,,,,,"[{'screen_name': 'napgener', 'name': 'Fraxgener 200x', 'id': '1336785837288251396'}]",,,,
10,1599616247007567872,1599615318535462914,1670213207000.0,2022-12-05 09:36:47,+0530,,"@everythingempt0 Prolly is, flow hasn't really happened yet. I'm not good at joining these things late though. I either plan well in advance or I don't really participate.",en,[],[],1444376487457603587,1444376487457603587,NorthRockLP,Hal Press,1,09,https://twitter.com/NorthRockLP/status/1599616247007567872,[],[],0,,False,3,1,0,,None,,,,,,,"[{'screen_name': 'everythingempt0', 'name': 'everythingempty', 'id': '1430887571148611588'}]",,,,
11,1599615318535462914,1599615318535462914,1670212986000.0,2022-12-05 09:33:06,+0530,,APE was a good long trade on staking going live. I didn't pay attention till it was too late. Was a miss on my part. Think there will be a trade on the short side at some point too though and am monitoring for the right entry on that.,en,[],[],1444376487457603587,1444376487457603587,NorthRockLP,Hal Press,1,09,https://twitter.com/NorthRockLP/status/1599615318535462914,[],[],0,,False,41,9,2,,None,,,,,,,[],,,,
12,1599608722879238144,1599608722879238144,1670211413000.0,2022-12-05 09:06:53,+0530,,Entire weekend move now retraced. 🤝  https://t.co/Q06ckp1w12,en,[],[],1444376487457603587,1444376487457603587,NorthRockLP,Hal Press,1,09,https://twitter.com/NorthRockLP/status/1599608722879238144,[],['https://pbs.twimg.com/media/FjLzPB4XoAAHS9t.png'],1,https://pbs.twimg.com/media/FjLzPB4XoAAHS9t.png,False,36,1,1,https://twitter.com/NorthRockLP/status/1599477250662969345,None,,,,,,,[],,,,
13,1599595721954451457,1599595721954451457,1670208313000.0,2022-12-05 08:15:13,+0530,,Very large perp offers at Binance may cap price below 1300 for a bit. Roughly 25k offered at 1300 and another 10k at 1310.  https://t.co/OAU1hpCqQA,en,[],[],1444376487457603587,1444376487457603587,NorthRockLP,Hal Press,1,08,https://twitter.com/NorthRockLP/status/1599595721954451457,[],['https://pbs.twimg.com/media/FjLno6tXoAAe6ns.png'],1,https://pbs.twimg.com/media/FjLno6tXoAAe6ns.png,False,45,4,1,,None,,,,,,,[],,,,
14,1599587441165635585,1599587441165635585,1670206339000.0,2022-12-05 07:42:19,+0530,,Whatever this was looks like it's finally over.  https://t.co/v30ixbJXpQ,en,[],[],1444376487457603587,1444376487457603587,NorthRockLP,Hal Press,1,07,https://twitter.com/NorthRockLP/status/1599587441165635585,[],['https://pbs.twimg.com/media/FjLgNR3XwAAoG5M.jpg'],1,https://pbs.twimg.com/media/FjLgNR3XwAAoG5M.jpg,False,35,5,0,https://twitter.com/NorthRockLP/status/1599463097806163969,None,,,,,,,[],,,,
15,1599583555457191936,1599494518029529089,1670205413000.0,2022-12-05 07:26:53,+0530,,@ShrimpyPong Many different reasons. Maybe I’ll write up a thread later.,en,[],[],1444376487457603587,1444376487457603587,NorthRockLP,Hal Press,1,07,https://twitter.com/NorthRockLP/status/1599583555457191936,[],[],0,,False,4,0,0,,None,,,,,,,"[{'screen_name': 'ShrimpyPong', 'name': 'Shrimpy', 'id': '1388299500150681605'}]",,,,
16,1599562994467282944,1599562994467282944,1670200510000.0,2022-12-05 06:05:10,+0530,,Still holding...  https://t.co/HsWWuOwmGS,en,[],[],1444376487457603587,1444376487457603587,NorthRockLP,Hal Press,1,06,https://twitter.com/NorthRockLP/status/1599562994467282944,[],['https://pbs.twimg.com/media/FjLJ-VLXwAEHqe5.png'],1,https://pbs.twimg.com/media/FjLJ-VLXwAEHqe5.png,False,22,5,0,https://twitter.com/NorthRockLP/status/1598096504505651202,None,,,,,,,[],,,,
17,1599527223924379649,1599491719988318209,1670191982000.0,2022-12-05 03:43:02,+0530,,"@DeFiSurfer808 That's the point. Most people, yourself included, disagreed when I said this is what would happen multiple months ago.",en,[],[],1444376487457603587,1444376487457603587,NorthRockLP,Hal Press,1,03,https://twitter.com/NorthRockLP/status/1599527223924379649,[],[],0,,False,1,1,0,,None,,,,,,,"[{'screen_name': 'DeFiSurfer808', 'name': 'DeFi Surfer 🫐,💎', 'id': '1273384503210160128'}]",,,,
18,1599510856773271552,1599494518029529089,1670188080000.0,2022-12-05 02:38:00,+0530,,@alfapeachmelba Price of the tokens declared securities will get smoked. No doubt about that.,en,[],[],1444376487457603587,1444376487457603587,NorthRockLP,Hal Press,1,02,https://twitter.com/NorthRockLP/status/1599510856773271552,[],[],0,,False,1,1,0,,None,,,,,,,"[{'screen_name': 'alfapeachmelba', 'name': 'justdesserts', 'id': '1488033093005062152'}]",,,,
19,1599506976098385920,1599502425462710274,1670187155000.0,2022-12-05 02:22:35,+0530,,@FlareyGorb Possible. That's the beauty of markets. We'll find out.,en,[],[],1444376487457603587,1444376487457603587,NorthRockLP,Hal Press,1,02,https://twitter.com/NorthRockLP/status/1599506976098385920,[],[],0,,False,3,0,0,,None,,,,,,,"[{'screen_name': 'FlareyGorb', 'name': 'Flarey Gorb', 'id': '1593571817972695040'}]",,,,
20,1599505241656897536,1599505241656897536,1670186741000.0,2022-12-05 02:15:41,+0530,,Hopefully a lot of the Gox creditors are now ETH maxis 🤣,en,[],[],1444376487457603587,1444376487457603587,NorthRockLP,Hal Press,1,02,https://twitter.com/NorthRockLP/status/1599505241656897536,[],[],0,,False,50,2,2,https://twitter.com/antiprosynth/status/1599504290132873216,None,,,,,,,[],,,,
21,1599505132831449088,1599473569284530176,1670186715000.0,2022-12-05 02:15:15,+0530,,@antiprosynth This is the way 🤣,en,[],[],1444376487457603587,1444376487457603587,NorthRockLP,Hal Press,1,02,https://twitter.com/NorthRockLP/status/1599505132831449088,[],[],0,,False,14,0,0,,None,,,,,,,"[{'screen_name': 'antiprosynth', 'name': 'antiprosynthesis.eth ⟠', 'id': '863083003081359362'}]",,,,
22,1599503434105098240,1599502425462710274,1670186310000.0,2022-12-05 02:08:30,+0530,,"@yowassuprj Inflation, by definition, is a rate of change measurement. Absolute level of price is irrelevant. All that matters is price vs comparable period (either last month or last year).",en,[],[],1444376487457603587,1444376487457603587,NorthRockLP,Hal Press,1,02,https://twitter.com/NorthRockLP/status/1599503434105098240,[],[],0,,False,3,1,0,,None,,,,,,,"[{'screen_name': 'yowassuprj', 'name': 'michael', 'id': '1865234156'}]",,,,
23,1599503195323043842,1599502425462710274,1670186253000.0,2022-12-05 02:07:33,+0530,,"@zksyncenjoyer Nope. FED gonna target 2%. All indications are that we will get there too, at least for a period of time.",en,[],[],1444376487457603587,1444376487457603587,NorthRockLP,Hal Press,1,02,https://twitter.com/NorthRockLP/status/1599503195323043842,[],[],0,,False,2,1,0,,None,,,,,,,"[{'screen_name': 'zksyncenjoyer', 'name': 'zksyncenjoyer', 'id': '1457085327949008899'}]",,,,
24,1599502425462710274,1599502425462710274,1670186070000.0,2022-12-05 02:04:30,+0530,,"TBH, I would have expected the ""inflation will moderate quickly"" view to be consensus by now, but I still see so many misinformed takes on it. Makes me optimistic there is still upside to the view.",en,[],[],1444376487457603587,1444376487457603587,NorthRockLP,Hal Press,1,02,https://twitter.com/NorthRockLP/status/1599502425462710274,[],[],0,,False,43,7,2,,None,,,,,,,[],,,,
25,1599497149825228801,1599492930288291841,1670184812000.0,2022-12-05 01:43:32,+0530,,"@JFK33830805 Prices are declining, not increasing less. This is deflation not slower inflation.",en,[],[],1444376487457603587,1444376487457603587,NorthRockLP,Hal Press,1,01,https://twitter.com/NorthRockLP/status/1599497149825228801,[],[],0,,False,6,3,1,,None,,,,,,,"[{'screen_name': 'JFK33830805', 'name': ""John Law's Ghost"", 'id': '1352793326341279745'}]",,,,
26,1599495752186621953,1599494518029529089,1670184479000.0,2022-12-05 01:37:59,+0530,,@SlimBeleggen Super super low odds this works for anyone. Regs are way too tight.,en,[],[],1444376487457603587,1444376487457603587,NorthRockLP,Hal Press,1,01,https://twitter.com/NorthRockLP/status/1599495752186621953,[],[],0,,False,2,1,0,,None,,,,,,,"[{'screen_name': 'SlimBeleggen', 'name': 'Slim Beleggen', 'id': '74462671'}]",,,,
27,1599495634028965890,1599492930288291841,1670184451000.0,2022-12-05 01:37:31,+0530,,@chamathsintern  https://t.co/5mpbxmldjR,qme,[],[],1444376487457603587,1444376487457603587,NorthRockLP,Hal Press,1,01,https://twitter.com/NorthRockLP/status/1599495634028965890,['https://twitter.com/NorthRockLP/status/1599495510523805696?s=20&t=9bkkOcAQByS4SchwO9Ibyg'],[],0,,False,1,0,0,https://twitter.com/NorthRockLP/status/1599495510523805696?s=20&t=9bkkOcAQByS4SchwO9Ibyg,None,,,,,,,"[{'screen_name': 'chamathsintern', 'name': 'why ッ', 'id': '1405370122953531399'}]",,,,
28,1599495510523805696,1599495510523805696,1670184421000.0,2022-12-05 01:37:01,+0530,,Another view for those who want more context.... GG  https://t.co/NszB9YiCyM,en,[],[],1444376487457603587,1444376487457603587,NorthRockLP,Hal Press,1,01,https://twitter.com/NorthRockLP/status/1599495510523805696,[],['https://pbs.twimg.com/media/FjKMpM1WQAAZ6Cy.png'],1,https://pbs.twimg.com/media/FjKMpM1WQAAZ6Cy.png,False,18,0,1,https://twitter.com/NorthRockLP/status/1599492930288291841,None,,,,,,,[],,,,
29,1599494523180093441,1599494518029529089,1670184186000.0,2022-12-05 01:33:06,+0530,,"This is the primary reason this sort of policy would make no sense. It wouldn't accomplish anything and would just push more value offshore. Also FWIW, in regard to ETH specifically from the research I have done I think low odds it's ever declared a security even if others are.",en,[],[],1444376487457603587,1444376487457603587,NorthRockLP,Hal Press,1,01,https://twitter.com/NorthRockLP/status/1599494523180093441,[],[],0,,False,42,4,2,,None,,,,,,,[],,,,
30,1599494520689025025,1599494518029529089,1670184185000.0,2022-12-05 01:33:05,+0530,,This is not to downplay the impact of this potential event. It would create massive supply headwinds for the tokens declared securities but they would still exist and function normally. All the volume would just move overseas.,en,[],[],1444376487457603587,1444376487457603587,NorthRockLP,Hal Press,1,01,https://twitter.com/NorthRockLP/status/1599494520689025025,[],[],0,,False,30,2,0,,None,,,,,,,[],,,,
31,1599494518029529089,1599494518029529089,1670184184000.0,2022-12-05 01:33:04,+0530,,A lot of people ask me what happens if token XYZ is declared a security. The answer is that US exchanges have to delist or face legal repercussions. That's basically it.,en,[],[],1444376487457603587,1444376487457603587,NorthRockLP,Hal Press,1,01,https://twitter.com/NorthRockLP/status/1599494518029529089,[],[],0,,False,81,6,8,,None,,,,,,,[],,,,
32,1599492930288291841,1599492930288291841,1670183806000.0,2022-12-05 01:26:46,+0530,,"For the next 6 months, being an inflationista is the same as trying to long this chart. Good luck.  https://t.co/lDYoVhVS4S",en,[],[],1444376487457603587,1444376487457603587,NorthRockLP,Hal Press,1,01,https://twitter.com/NorthRockLP/status/1599492930288291841,[],['https://pbs.twimg.com/media/FjKKTpiXwAID3I9.png'],1,https://pbs.twimg.com/media/FjKKTpiXwAID3I9.png,False,62,8,2,,None,,,,,,,[],,,,
33,1599491719988318209,1599491719988318209,1670183517000.0,2022-12-05 01:21:57,+0530,,"The economy is too strong, inflation will never decline they said.  https://t.co/1N7dmooNqz",en,[],[],1444376487457603587,1444376487457603587,NorthRockLP,Hal Press,1,01,https://twitter.com/NorthRockLP/status/1599491719988318209,[],['https://pbs.twimg.com/media/FjKJJvAXoA8YF52.png'],1,https://pbs.twimg.com/media/FjKJJvAXoA8YF52.png,False,37,4,4,,None,,,,,,,[],,,,
34,1599477250662969345,1599477250662969345,1670180068000.0,2022-12-05 00:24:28,+0530,,Always fade illiquid weekend flows. Always.  https://t.co/b0wHRjXX0V,en,[],[],1444376487457603587,1444376487457603587,NorthRockLP,Hal Press,1,00,https://twitter.com/NorthRockLP/status/1599477250662969345,[],['https://pbs.twimg.com/media/FjJ8AkNXkAMDlVB.png'],1,https://pbs.twimg.com/media/FjJ8AkNXkAMDlVB.png,False,49,4,3,,None,,,,,,,[],,,,
35,1599476572880134144,1599463097806163969,1670179906000.0,2022-12-05 00:21:46,+0530,,"@CL207 Agree, all of the 400k clearly not being being and sold. My guess is that the perp and spot orders are connected and likely net bot then net sold on some sort of ratio.",en,[],[],1444376487457603587,1444376487457603587,NorthRockLP,Hal Press,1,00,https://twitter.com/NorthRockLP/status/1599476572880134144,[],[],0,,False,11,1,0,,None,,,,,,,"[{'screen_name': 'CL207', 'name': 'CL', 'id': '1073132650309726208'}]",,,,
36,1599475581728407552,1599475078051561472,1670179670000.0,2022-12-05 00:17:50,+0530,,@LeeXBT Shanghai likely post gox. One step at a time. Also think Shanghai flow smaller and comes with more accompanying positives.,en,[],[],1444376487457603587,1444376487457603587,NorthRockLP,Hal Press,1,00,https://twitter.com/NorthRockLP/status/1599475581728407552,[],[],0,,False,4,3,0,,None,,,,,,,"[{'screen_name': 'LeeXBT', 'name': 'O.O', 'id': '1394442337774968833'}]",,,,
37,1599475078051561472,1599475078051561472,1670179550000.0,2022-12-05 00:15:50,+0530,,"If you think a lot of this gets sold, IMO, one of the easiest ways to play it is to long ETHBTC. This distro gonna come sooner than most realize and many traders will rotate BTC exposure to ETH to get in front of it.",en,[],[],1444376487457603587,1444376487457603587,NorthRockLP,Hal Press,1,00,https://twitter.com/NorthRockLP/status/1599475078051561472,[],[],0,,False,43,2,3,https://twitter.com/NorthRockLP/status/1599473569284530176,None,,,,,,,[],,,,
38,1599474210639708161,1599463097806163969,1670179343000.0,2022-12-05 00:12:23,+0530,,"@CL207 So when you say ""fake"" what does that actually mean? Also the unwind this weekend did clearly create negative PA when it started, so did seem to have at least *some* directional component?",en,[],[],1444376487457603587,1444376487457603587,NorthRockLP,Hal Press,1,00,https://twitter.com/NorthRockLP/status/1599474210639708161,[],[],0,,False,9,2,0,,None,,,,,,,"[{'screen_name': 'CL207', 'name': 'CL', 'id': '1073132650309726208'}]",,,,
39,1599473569284530176,1599473569284530176,1670179190000.0,2022-12-05 00:09:50,+0530,,What portion of Gox bitcoins do you think will end up being sold when distributed? This should include both people who elect the cash option and those who elect to receive spot but then sell some of it. Ie if Gox distributed 140k coins what % end up actually being sold.,en,[],[],1444376487457603587,1444376487457603587,NorthRockLP,Hal Press,1,00,https://twitter.com/NorthRockLP/status/1599473569284530176,[],[],0,,False,16,6,2,,None,,,,,,,[],,,,
40,1599467511111483394,1599467511111483394,1670177745000.0,2022-12-04 23:45:45,+0530,,ETHBTC shows the heavy sell pressure earlier in the weekend. Whatever that flow was seems to be over now.  https://t.co/4KUV3MTjhp,en,[],[],1444376487457603587,1444376487457603587,NorthRockLP,Hal Press,7,23,https://twitter.com/NorthRockLP/status/1599467511111483394,[],['https://pbs.twimg.com/media/FjJzBtNX0AACONS.png'],1,https://pbs.twimg.com/media/FjJzBtNX0AACONS.png,False,23,1,1,https://twitter.com/NorthRockLP/status/1599465571846090752,None,,,,,,,[],,,,
41,1599465571846090752,1599465571846090752,1670177283000.0,2022-12-04 23:38:03,+0530,,Regardless of WTF is going on there were several long liquidations during illiquid weekend hours. Now that all those frothy positions have been purged the set up is better in the short term.,en,[],[],1444376487457603587,1444376487457603587,NorthRockLP,Hal Press,7,23,https://twitter.com/NorthRockLP/status/1599465571846090752,[],[],0,,False,26,1,1,https://twitter.com/NorthRockLP/status/1599463097806163969,None,,,,,,,[],,,,
42,1599463103116124160,1599463097806163969,1670176695000.0,2022-12-04 23:28:15,+0530,,"Also, we are talking about 400k ETH by what seems like a single entity so it's not small either.",en,[],[],1444376487457603587,1444376487457603587,NorthRockLP,Hal Press,7,23,https://twitter.com/NorthRockLP/status/1599463103116124160,[],[],0,,False,39,10,0,,None,,,,,,,[],,,,
43,1599463100679233536,1599463097806163969,1670176694000.0,2022-12-04 23:28:14,+0530,,"Initially, I thought the build was someone swapping spot for perp. But then the unwind this weekend made it seem like it was outright. And now the positive funding and better PA makes it seem like it's no longer unwinding outright? 🤔",en,[],[],1444376487457603587,1444376487457603587,NorthRockLP,Hal Press,7,23,https://twitter.com/NorthRockLP/status/1599463100679233536,[],[],0,,False,27,3,0,,None,,,,,,,[],,,,
44,1599463097806163969,1599463097806163969,1670176693000.0,2022-12-04 23:28:13,+0530,,I have no clue what is going on here. Extremely odd moves at very large size.  Especially now that funding has flipped positive while unwind still ongoing.  https://t.co/Du3HQbY7gM,en,[],[],1444376487457603587,1444376487457603587,NorthRockLP,Hal Press,7,23,https://twitter.com/NorthRockLP/status/1599463097806163969,[],['https://pbs.twimg.com/media/FjJvLd7XkAI5lDa.png'],1,https://pbs.twimg.com/media/FjJvLd7XkAI5lDa.png,False,127,8,9,,None,,,,,,,[],,,,
45,1599106847151362050,1599105949457068033,1670091756000.0,2022-12-03 23:52:36,+0530,,@chainlinkpapi_ @GuyDealership He's mostly used car and doesn't have any real data no?,en,[],[],1444376487457603587,1444376487457603587,NorthRockLP,Hal Press,6,23,https://twitter.com/NorthRockLP/status/1599106847151362050,[],[],0,,False,0,0,0,,None,,,,,,,"[{'screen_name': 'chainlinkpapi_', 'name': 'chainlinkpapi.eth', 'id': '1516833470722588686'}, {'screen_name': 'GuyDealership', 'name': 'CarDealershipGuy', 'id': '1475231323480543232'}]",,,,
46,1599105949457068033,1599105949457068033,1670091542000.0,2022-12-03 23:49:02,+0530,,Updated near term CPI model. Projecting in-line print for Dec but moderation below 2% normalized core CPI by March '23. One area I don't have a great feel for is new car prices. I have good data for used cars but not new. Anyone know where to find good data on this?  https://t.co/hhVlKpXMpd,en,[],[],1444376487457603587,1444376487457603587,NorthRockLP,Hal Press,6,23,https://twitter.com/NorthRockLP/status/1599105949457068033,[],['https://pbs.twimg.com/media/FjEp_CMUoAA9yOH.png'],1,https://pbs.twimg.com/media/FjEp_CMUoAA9yOH.png,False,40,6,1,,None,,,,,,,[],,,,
47,1599102182623961088,1598750100813099008,1670090644000.0,2022-12-03 23:34:04,+0530,,"@DeFiSurfer808 Most of the inflation hawks say we need UR above 6% to get inflation down. Larry Summers is on record with this exact claim. So, in my mind anything south of there should be considered soft.",en,[],[],1444376487457603587,1444376487457603587,NorthRockLP,Hal Press,6,23,https://twitter.com/NorthRockLP/status/1599102182623961088,[],[],0,,False,3,0,0,,None,,,,,,,"[{'screen_name': 'DeFiSurfer808', 'name': 'DeFi Surfer 🫐,💎', 'id': '1273384503210160128'}]",,,,
48,1599101464022249472,1599101464022249472,1670090473000.0,2022-12-03 23:31:13,+0530,,Important note. There is obviously a seasonal dynamic where rents decline this time of year. The point is not to show the last couple negative prints but rather to show they are *more negative* than previous Oct/Nov periods (negative even after seasonal adjustment).,en,[],[],1444376487457603587,1444376487457603587,NorthRockLP,Hal Press,6,23,https://twitter.com/NorthRockLP/status/1599101464022249472,[],[],0,,False,19,2,1,https://twitter.com/NorthRockLP/status/1599095944774967296,None,,,,,,,[],,,,
49,1599098523022393346,1598750100813099008,1670089772000.0,2022-12-03 23:19:32,+0530,,@DeFiSurfer808 Happy?   https://t.co/YD54GEqbJo,en,[],[],1444376487457603587,1444376487457603587,NorthRockLP,Hal Press,6,23,https://twitter.com/NorthRockLP/status/1599098523022393346,['https://twitter.com/NorthRockLP/status/1599098392504066048?s=20&t=Lqtre3NbgHOpsnPcaEm2Mw'],[],0,,False,2,1,0,https://twitter.com/NorthRockLP/status/1599098392504066048?s=20&t=Lqtre3NbgHOpsnPcaEm2Mw,None,,,,,,,"[{'screen_name': 'DeFiSurfer808', 'name': 'DeFi Surfer 🫐,💎', 'id': '1273384503210160128'}]",,,,
50,1599098392504066048,1599098392504066048,1670089741000.0,2022-12-03 23:19:01,+0530,,"7.5% was meant as an upper bound and would still be significantly below the UR reached in the last two recessions. However, I'll go a bit further and say its unlikely we even see UR get above 5%.",en,[],[],1444376487457603587,1444376487457603587,NorthRockLP,Hal Press,6,23,https://twitter.com/NorthRockLP/status/1599098392504066048,[],[],0,,False,9,1,0,https://twitter.com/NorthRockLP/status/1598750100813099008,None,,,,,,,[],,,,
51,1599097539772690432,1599095933337497602,1670089537000.0,2022-12-03 23:15:37,+0530,,@CryptoChrisG 7.5% is an upper bound. I'd guess it peaks even lower than that. Crash landing would be 10%.,en,[],[],1444376487457603587,1444376487457603587,NorthRockLP,Hal Press,6,23,https://twitter.com/NorthRockLP/status/1599097539772690432,[],[],0,,False,3,0,0,,None,,,,,,,"[{'screen_name': 'CryptoChrisG', 'name': 'B', 'id': '2598834794'}]",,,,
