,id,conversation_id,created_at,date,timezone,place,tweet,language,hashtags,cashtags,user_id,user_id_str,username,name,day,hour,link,urls,photos,video,thumbnail,retweet,nlikes,nreplies,nretweets,quote_url,search,near,geo,source,user_rt_id,user_rt,retweet_id,reply_to,retweet_date,translate,trans_src,trans_dest
52,1599097175979732992,1599095933337497602,1670089451000.0,2022-12-03 23:14:11,+0530,,@alexNGMI I took the evening off. That was enough 😉,en,[],[],1444376487457603587,1444376487457603587,NorthRockLP,Hal Press,6,23,https://twitter.com/NorthRockLP/status/1599097175979732992,[],[],0,,False,2,0,0,,None,,,,,,,"[{'screen_name': 'alexNGMI', 'name': 'ً', 'id': '956555996373057537'}]",,,,
53,1599097030357708801,1598750100813099008,1670089416000.0,2022-12-03 23:13:36,+0530,,@DickeyNate It's 3.7% right now. I'd guess pretty decent odds it peaks below 5%.,en,[],[],1444376487457603587,1444376487457603587,NorthRockLP,Hal Press,6,23,https://twitter.com/NorthRockLP/status/1599097030357708801,[],[],0,,False,1,0,0,,None,,,,,,,"[{'screen_name': 'DickeyNate', 'name': 'Andrew Weiner', 'id': '437951039'}]",,,,
54,1599095950450266112,1599095933337497602,1670089159000.0,2022-12-03 23:09:19,+0530,,"Of course we could have significant economic deterioration anyway and I don't have a strong view about how much of that we will see. However, I think it's very unlikely FED will have to *force* a bad recession to get inflation down and therefore a severe outcome is less likely.",en,[],[],1444376487457603587,1444376487457603587,NorthRockLP,Hal Press,6,23,https://twitter.com/NorthRockLP/status/1599095950450266112,[],[],0,,False,11,2,0,,None,,,,,,,[],,,,
55,1599095947690389504,1599095933337497602,1670089158000.0,2022-12-03 23:09:18,+0530,,All of this to say that it's very likely inflation moderates back to 2% (or below) even if we don't have significant further economic deterioration.,en,[],[],1444376487457603587,1444376487457603587,NorthRockLP,Hal Press,6,23,https://twitter.com/NorthRockLP/status/1599095947690389504,[],[],0,,False,5,1,0,,None,,,,,,,[],,,,
56,1599095944774967296,1599095933337497602,1670089157000.0,2022-12-03 23:09:17,+0530,,"We can predict this with high certainty because new rents have already started dropping quickly (negative MoM, aka deflation) and we know CPI rent follows new rents.  https://t.co/kFjgTHk0bn",en,[],[],1444376487457603587,1444376487457603587,NorthRockLP,Hal Press,6,23,https://twitter.com/NorthRockLP/status/1599095944774967296,[],['https://pbs.twimg.com/media/FjEg6UwUYAA5LSf.png'],1,https://pbs.twimg.com/media/FjEg6UwUYAA5LSf.png,False,10,2,0,,None,,,,,,,[],,,,
57,1599095942040649729,1599095933337497602,1670089157000.0,2022-12-03 23:09:17,+0530,,"More importantly even than this, is the fact that rental inflation will likely moderate sharply to 0 or negative in the next 6-9 months.",en,[],[],1444376487457603587,1444376487457603587,NorthRockLP,Hal Press,6,23,https://twitter.com/NorthRockLP/status/1599095942040649729,[],[],0,,False,8,1,0,,None,,,,,,,[],,,,
58,1599095939079499777,1599095933337497602,1670089156000.0,2022-12-03 23:09:16,+0530,,"Even in last month's lower inflation print, rents contributed OVER 100% of all core inflation. This means that had we excluded rents core inflation would already be negative.  https://t.co/M70tg6WVHp",en,[],[],1444376487457603587,1444376487457603587,NorthRockLP,Hal Press,6,23,https://twitter.com/NorthRockLP/status/1599095939079499777,[],['https://pbs.twimg.com/media/FjEgxCyVIAE1ohE.png'],1,https://pbs.twimg.com/media/FjEgxCyVIAE1ohE.png,False,9,1,0,,None,,,,,,,[],,,,
59,1599095936428347392,1599095933337497602,1670089155000.0,2022-12-03 23:09:15,+0530,,Many things contribute to why I think inflation will continue to moderate but the most important factor is rents.,en,[],[],1444376487457603587,1444376487457603587,NorthRockLP,Hal Press,6,23,https://twitter.com/NorthRockLP/status/1599095936428347392,[],[],0,,False,3,1,0,,None,,,,,,,[],,,,
60,1599095933337497602,1599095933337497602,1670089154000.0,2022-12-03 23:09:14,+0530,,This article is somewhat similar to my view. Although I would say my view is even more focused on the inflation side of the picture.   https://t.co/qsNiYvFE3U,en,[],[],1444376487457603587,1444376487457603587,NorthRockLP,Hal Press,6,23,https://twitter.com/NorthRockLP/status/1599095933337497602,['https://stayathomemacro.substack.com/p/burden-of-proof-is-on-the-inflation?utm_source=profile&utm_medium=reader2'],[],0,,False,21,5,1,https://twitter.com/NorthRockLP/status/1598750100813099008,None,,,,,,,[],,,,
61,1598796891721850880,1598795628381089792,1670017857000.0,2022-12-03 03:20:57,+0530,,@cryptamurai Tomorrow likely…. Lmao,en,[],[],1444376487457603587,1444376487457603587,NorthRockLP,Hal Press,6,03,https://twitter.com/NorthRockLP/status/1598796891721850880,[],[],0,,False,3,0,0,,None,,,,,,,"[{'screen_name': 'cryptamurai', 'name': 'Cryptamurai 🛸 I County Capital', 'id': '914788213763559424'}]",,,,
62,1598795628381089792,1598795628381089792,1670017556000.0,2022-12-03 03:15:56,+0530,,Now for real! Shutting it off.,en,[],[],1444376487457603587,1444376487457603587,NorthRockLP,Hal Press,6,03,https://twitter.com/NorthRockLP/status/1598795628381089792,[],[],0,,False,24,2,0,https://twitter.com/NorthRockLP/status/1598788839216009216,None,,,,,,,[],,,,
63,1598794751385694208,1598794751385694208,1670017347000.0,2022-12-03 03:12:27,+0530,,"While this specific line is likely going to help avoid regulatory issues, it is also likely going to raise concern among some holders. I have TP'd and will just move on. No strong view here, few competing forces.  https://t.co/rG2GkPqtQN",en,[],[],1444376487457603587,1444376487457603587,NorthRockLP,Hal Press,6,03,https://twitter.com/NorthRockLP/status/1598794751385694208,[],['https://pbs.twimg.com/media/FjAOx5oUAAAlGFr.png'],1,https://pbs.twimg.com/media/FjAOx5oUAAAlGFr.png,False,14,2,1,https://twitter.com/NorthRockLP/status/1598773419385839616,None,,,,,,,[],,,,
64,1598788839216009216,1598788839216009216,1670015937000.0,2022-12-03 02:48:57,+0530,,Been a long few weeks. Gonna try to shut it off for a bit. Enjoy the weekend everyone.,en,[],[],1444376487457603587,1444376487457603587,NorthRockLP,Hal Press,6,02,https://twitter.com/NorthRockLP/status/1598788839216009216,[],[],0,,False,51,3,0,,None,,,,,,,[],,,,
65,1598785773230170115,1598746592395558912,1670015206000.0,2022-12-03 02:36:46,+0530,,@andy0___ Not decentralized.,en,[],[],1444376487457603587,1444376487457603587,NorthRockLP,Hal Press,6,02,https://twitter.com/NorthRockLP/status/1598785773230170115,[],[],0,,False,11,7,0,,None,,,,,,,"[{'screen_name': 'andy0___', 'name': 'Andy', 'id': '919968511'}]",,,,
66,1598774499440463872,1598772514817441792,1670012519000.0,2022-12-03 01:51:59,+0530,,@DickeyNate Regulatory concern will not last forever.....,en,[],[],1444376487457603587,1444376487457603587,NorthRockLP,Hal Press,6,01,https://twitter.com/NorthRockLP/status/1598774499440463872,[],[],0,,False,2,0,0,,None,,,,,,,"[{'screen_name': 'DickeyNate', 'name': 'Andrew Weiner', 'id': '437951039'}]",,,,
67,1598773419385839616,1598773419385839616,1670012261000.0,2022-12-03 01:47:41,+0530,,A summary of what is being proposed:  Right now Uniswap makes 0 money. The proposal is to change that and allow Uniswap to start making money but not returning that money to holders. The money will just be sent to the treasury and used by Uni. Step forward but not total solution.,en,[],[],1444376487457603587,1444376487457603587,NorthRockLP,Hal Press,6,01,https://twitter.com/NorthRockLP/status/1598773419385839616,[],[],0,,False,72,8,4,https://twitter.com/NorthRockLP/status/1598772514817441792,None,,,,,,,[],,,,
68,1598772514817441792,1598772514817441792,1670012045000.0,2022-12-03 01:44:05,+0530,,"The reason this does not try to return fees to holders is because that would lead to regulatory concerns. However, the fact that this is explicitly not what they are trying to do makes this much more likely to pass and would still be a big step forward.",en,[],[],1444376487457603587,1444376487457603587,NorthRockLP,Hal Press,6,01,https://twitter.com/NorthRockLP/status/1598772514817441792,[],[],0,,False,21,3,0,https://twitter.com/NorthRockLP/status/1598770216548171776,None,,,,,,,[],,,,
69,1598770216548171776,1598770216548171776,1670011497000.0,2022-12-03 01:34:57,+0530,,I bot some UNI around 6.15 on this. Think this has potential to be quite a strong narrative in an app token starved market. Haven't seen many people talking about this before either which is a positive.,en,[],[],1444376487457603587,1444376487457603587,NorthRockLP,Hal Press,6,01,https://twitter.com/NorthRockLP/status/1598770216548171776,[],[],0,,False,36,5,4,https://twitter.com/NorthRockLP/status/1598767075375255552,None,,,,,,,[],,,,
70,1598767075375255552,1598767075375255552,1670010749000.0,2022-12-03 01:22:29,+0530,,Very interesting. The long time concern with UNI was no fee switch. Now looks like that issue could be solved in the not to distant future.   https://t.co/oNEmGFwv8I,en,[],[],1444376487457603587,1444376487457603587,NorthRockLP,Hal Press,6,01,https://twitter.com/NorthRockLP/status/1598767075375255552,['https://gov.uniswap.org/t/fee-switch-pilot-update-vote/19514'],[],0,,False,57,8,9,,None,,,,,,,[],,,,
71,1598751854997176320,1598750100813099008,1670007120000.0,2022-12-03 00:22:00,+0530,,"@DickeyNate Where would you set the ""soft"" cutoff? We did 10% in '08 and 15% with covid.",en,[],[],1444376487457603587,1444376487457603587,NorthRockLP,Hal Press,6,00,https://twitter.com/NorthRockLP/status/1598751854997176320,[],[],0,,False,4,2,0,,None,,,,,,,"[{'screen_name': 'DickeyNate', 'name': 'Andrew Weiner', 'id': '437951039'}]",,,,
72,1598750103376101377,1598750100813099008,1670006702000.0,2022-12-03 00:15:02,+0530,,Time will tell and we can check back in 12 months to see what happened.,en,[],[],1444376487457603587,1444376487457603587,NorthRockLP,Hal Press,6,00,https://twitter.com/NorthRockLP/status/1598750103376101377,[],[],0,,False,15,2,0,,None,,,,,,,[],,,,
73,1598750100813099008,1598750100813099008,1670006702000.0,2022-12-03 00:15:02,+0530,,"My honest base case is a ""soft"" landing.  I'd define it as CPI getting back below 3% and GDP troughing without unemployment going above 7.5%. Most will say I'm naïve and stupid for expecting this, but when I look at the data and try to forecast it seems like most likely scenario.",en,[],[],1444376487457603587,1444376487457603587,NorthRockLP,Hal Press,6,00,https://twitter.com/NorthRockLP/status/1598750100813099008,[],[],0,,False,91,12,1,,None,,,,,,,[],,,,
74,1598749007798759425,1598749007798759425,1670006441000.0,2022-12-03 00:10:41,+0530,,My best guess at flippening odds.   2023: 30% 2024: 20% (halving) 2025: 25% 2026-2030: 10% 2030-2050: 5% Never: 10%,en,[],[],1444376487457603587,1444376487457603587,NorthRockLP,Hal Press,6,00,https://twitter.com/NorthRockLP/status/1598749007798759425,[],[],0,,False,136,30,5,,None,,,,,,,[],,,,
75,1598747575120977921,1598746592395558912,1670006099000.0,2022-12-03 00:04:59,+0530,,@anondeguerre IMO it's already more important. Just my opinion though.,en,[],[],1444376487457603587,1444376487457603587,NorthRockLP,Hal Press,6,00,https://twitter.com/NorthRockLP/status/1598747575120977921,[],[],0,,False,32,1,0,,None,,,,,,,"[{'screen_name': 'anondeguerre', 'name': 'prithvi', 'id': '189934457'}]",,,,
76,1598746592395558912,1598746592395558912,1670005865000.0,2022-12-03 00:01:05,+0530,,Realistic chance that ETH ends up being the most important and influential asset of our entire generation. Don't worry though that won't stop the majority of people from FUD'ing themselves out of owning much of it.,en,[],[],1444376487457603587,1444376487457603587,NorthRockLP,Hal Press,6,00,https://twitter.com/NorthRockLP/status/1598746592395558912,[],[],0,,False,634,52,69,,None,,,,,,,[],,,,
77,1598709951957897218,1598709951957897218,1669997129000.0,2022-12-02 21:35:29,+0530,,Think we gonna be stuck in a pretty tight range for a while. Enjoy your weekend.,en,[],[],1444376487457603587,1444376487457603587,NorthRockLP,Hal Press,5,21,https://twitter.com/NorthRockLP/status/1598709951957897218,[],[],0,,False,46,0,0,,None,,,,,,,[],,,,
78,1598551848188669952,1598551848188669952,1669959434000.0,2022-12-02 11:07:14,+0530,,Very comprehensive GMX thesis overview.,en,[],[],1444376487457603587,1444376487457603587,NorthRockLP,Hal Press,5,11,https://twitter.com/NorthRockLP/status/1598551848188669952,[],[],0,,False,43,4,3,https://twitter.com/cosmo_jiang/status/1598396493286678528,None,,,,,,,[],,,,
79,1598543310607392768,1598543310607392768,1669957399000.0,2022-12-02 10:33:19,+0530,,"Even after continued outperformance GMX still yielding 7% just in ETH, (another 8% in vested GMX). Pretty insane TBH. Seems to have established real PMF. One of the very few ""cheap"" assets in the whole space. There are risks but it's as good R/R as there is.",en,[],[],1444376487457603587,1444376487457603587,NorthRockLP,Hal Press,5,10,https://twitter.com/NorthRockLP/status/1598543310607392768,[],[],0,,False,72,9,4,https://twitter.com/NorthRockLP/status/1591849625228640258,None,,,,,,,[],,,,
80,1598525196671090688,1598522030365626368,1669953080000.0,2022-12-02 09:21:20,+0530,,@aram_xyz In due time….,en,[],[],1444376487457603587,1444376487457603587,NorthRockLP,Hal Press,5,09,https://twitter.com/NorthRockLP/status/1598525196671090688,[],[],0,,False,3,0,0,,None,,,,,,,"[{'screen_name': 'aram_xyz', 'name': 'Aram', 'id': '1225903076277506048'}]",,,,
81,1598522030365626368,1598522030365626368,1669952325000.0,2022-12-02 09:08:45,+0530,,Some interesting trades and opportunities coming down the pipeline in the next ~4-6 months. I'm getting excited again.,en,[],[],1444376487457603587,1444376487457603587,NorthRockLP,Hal Press,5,09,https://twitter.com/NorthRockLP/status/1598522030365626368,[],[],0,,False,84,8,2,,None,,,,,,,[],,,,
82,1598506217416048640,1598506217416048640,1669948555000.0,2022-12-02 08:05:55,+0530,,Couldn’t agree with this take more. Can we please just stop giving him the time of day and all just ignore and move on?,en,[],[],1444376487457603587,1444376487457603587,NorthRockLP,Hal Press,5,08,https://twitter.com/NorthRockLP/status/1598506217416048640,[],[],0,,False,54,1,0,https://twitter.com/HsakaTrades/status/1598174228142264321,None,,,,,,,[],,,,
83,1598499432852779008,1598486735599849473,1669946938000.0,2022-12-02 07:38:58,+0530,,@thorallfather 🫡,und,[],[],1444376487457603587,1444376487457603587,NorthRockLP,Hal Press,5,07,https://twitter.com/NorthRockLP/status/1598499432852779008,[],[],0,,False,1,0,0,,None,,,,,,,"[{'screen_name': 'thorallfather', 'name': 'FrankWiz (💙,🧡)', 'id': '215812047'}]",,,,
84,1598485066790969344,1598478424963792896,1669943512000.0,2022-12-02 06:41:52,+0530,,"@nosleepjon ty ser, finally someone who gets it... lmao",en,[],[],1444376487457603587,1444376487457603587,NorthRockLP,Hal Press,5,06,https://twitter.com/NorthRockLP/status/1598485066790969344,[],[],0,,False,5,0,0,,None,,,,,,,"[{'screen_name': 'nosleepjon', 'name': 'NoSleepJon 💤⏩', 'id': '1346191144934367235'}]",,,,
85,1598478424963792896,1598478424963792896,1669941929000.0,2022-12-02 06:15:29,+0530,,Day one mark on ETH was 4650.  Year 1: 4650 -&gt; 1280 Year 2: 1280 -&gt; ???  👀,en,[],[],1444376487457603587,1444376487457603587,NorthRockLP,Hal Press,5,06,https://twitter.com/NorthRockLP/status/1598478424963792896,[],[],0,,False,58,18,1,https://twitter.com/NorthRockLP/status/1598478124085280768,None,,,,,,,[],,,,
86,1598478124085280768,1598478124085280768,1669941857000.0,2022-12-02 06:14:17,+0530,,Today is the one year anniversary of NRD. Can't believe it's only been a year. Learned more in the last year than most of the previous combined. Have enjoyed it immensely and am extremely excited for year two. Let's get it.,en,[],[],1444376487457603587,1444376487457603587,NorthRockLP,Hal Press,5,06,https://twitter.com/NorthRockLP/status/1598478124085280768,[],[],0,,False,158,13,0,,None,,,,,,,[],,,,
87,1598426009421881373,1598410818932056078,1669929432000.0,2022-12-02 02:47:12,+0530,,@tradejolter Not sure.,en,[],[],1444376487457603587,1444376487457603587,NorthRockLP,Hal Press,5,02,https://twitter.com/NorthRockLP/status/1598426009421881373,[],[],0,,False,0,0,0,,None,,,,,,,"[{'screen_name': 'tradejolter', 'name': ""Serge d'Adesky"", 'id': '1495906333207453699'}]",,,,
88,1598417679932862464,1598417679932862464,1669927446000.0,2022-12-02 02:14:06,+0530,,I thot Elon was supposed to get rid of the bots?? 🤔,en,[],[],1444376487457603587,1444376487457603587,NorthRockLP,Hal Press,5,02,https://twitter.com/NorthRockLP/status/1598417679932862464,[],[],0,,False,26,5,1,,None,,,,,,,[],,,,
89,1598414263756161025,1598414054942707713,1669926632000.0,2022-12-02 02:00:32,+0530,,What this tells you is that while there is still uncertainty on the path it's rather likely FED will be cutting rates again at some point in the not too distant future.,en,[],[],1444376487457603587,1444376487457603587,NorthRockLP,Hal Press,5,02,https://twitter.com/NorthRockLP/status/1598414263756161025,[],[],0,,False,21,4,0,,None,,,,,,,[],,,,
90,1598414054942707713,1598414054942707713,1669926582000.0,2022-12-02 01:59:42,+0530,,Single largest monthly decline in rents in the 5 year history of the survey. It's possible we see flat or even negative MoM CPI readings at some point next year.   https://t.co/q0UfokKSj7  https://t.co/AMutJOnTNl,en,[],[],1444376487457603587,1444376487457603587,NorthRockLP,Hal Press,5,01,https://twitter.com/NorthRockLP/status/1598414054942707713,['https://www.apartmentlist.com/research/national-rent-data'],['https://pbs.twimg.com/media/Fi60xIuX0AA0Kae.png'],1,https://pbs.twimg.com/media/Fi60xIuX0AA0Kae.png,False,73,4,7,,None,,,,,,,[],,,,
91,1598410818932056078,1598410818932056078,1669925810000.0,2022-12-02 01:46:50,+0530,,This is promising. What real progress looks like. Now we need to start building this kind of functionally into creative use cases to actually reduce friction in consumers lives.,en,[],[],1444376487457603587,1444376487457603587,NorthRockLP,Hal Press,5,01,https://twitter.com/NorthRockLP/status/1598410818932056078,[],[],0,,False,75,2,5,https://twitter.com/stripe/status/1598361957836279809,None,,,,,,,[],,,,
92,1598409252930043904,1598409252930043904,1669925437000.0,2022-12-02 01:40:37,+0530,,Housing mkt lookin real good.  https://t.co/Ji12pGPveO,en,[],[],1444376487457603587,1444376487457603587,NorthRockLP,Hal Press,5,01,https://twitter.com/NorthRockLP/status/1598409252930043904,[],['https://pbs.twimg.com/media/Fi6wqonWIA4Ikah.png'],1,https://pbs.twimg.com/media/Fi6wqonWIA4Ikah.png,False,261,52,32,,None,,,,,,,[],,,,
93,1598402868700405761,1598402868700405761,1669923915000.0,2022-12-02 01:15:15,+0530,,"Anyway, 0 reason to btch abt what could've been. Market owes you nothing. All we can do is look fwd.",en,[],[],1444376487457603587,1444376487457603587,NorthRockLP,Hal Press,5,01,https://twitter.com/NorthRockLP/status/1598402868700405761,[],[],0,,False,33,3,0,https://twitter.com/NorthRockLP/status/1598401679371763735,None,,,,,,,[],,,,
94,1598402377723260928,1598374128121221138,1669923798000.0,2022-12-02 01:13:18,+0530,,@StephenCesaro Recession is already priced and well understood. Has been for a very long time. Question is just on severity and I think we can see 2% with only minor recession.,en,[],[],1444376487457603587,1444376487457603587,NorthRockLP,Hal Press,5,01,https://twitter.com/NorthRockLP/status/1598402377723260928,[],[],0,,False,4,0,0,,None,,,,,,,"[{'screen_name': 'StephenCesaro', 'name': 'STΞPHΞN 🌾', 'id': '994030034'}]",,,,
95,1598401679371763735,1598401679371763735,1669923631000.0,2022-12-02 01:10:31,+0530,,Sam stole so much from us. We should be at 2k minimum... 😭  https://t.co/IsHOFv933T,en,[],[],1444376487457603587,1444376487457603587,NorthRockLP,Hal Press,5,01,https://twitter.com/NorthRockLP/status/1598401679371763735,[],"['https://pbs.twimg.com/media/Fi6pgFtXgBImzsW.png', 'https://pbs.twimg.com/media/Fi6pmUxXgBUqa5v.png', 'https://pbs.twimg.com/media/Fi6pv0HXgBQ3y7b.png']",1,https://pbs.twimg.com/media/Fi6pgFtXgBImzsW.png,False,94,6,2,,None,,,,,,,[],,,,
96,1598387366984499200,1598387366984499200,1669920219000.0,2022-12-02 00:13:39,+0530,, https://t.co/5hX9QwkloT,zxx,[],[],1444376487457603587,1444376487457603587,NorthRockLP,Hal Press,5,00,https://twitter.com/NorthRockLP/status/1598387366984499200,[],['https://pbs.twimg.com/media/Fi6c1lFWYA0_nwq.jpg'],1,https://pbs.twimg.com/media/Fi6c1lFWYA0_nwq.jpg,False,9,0,0,https://twitter.com/NorthRockLP/status/1598374128121221138,None,,,,,,,[],,,,
97,1598374128121221138,1598374128121221138,1669917063000.0,2022-12-01 23:21:03,+0530,,"No change in any of the data I look at. All indications continue to support the view that inflation is rapidly moderating and likely will return to a 2% run rate by Q1 or Q2 of next year (doesn't mean 2% YoY, means 2% annualized run rate when looking at MoM).  https://t.co/ROVrvIG3Ah",en,[],[],1444376487457603587,1444376487457603587,NorthRockLP,Hal Press,4,23,https://twitter.com/NorthRockLP/status/1598374128121221138,[],['https://pbs.twimg.com/media/Fi6QYnVXEBsm3jQ.png'],1,https://pbs.twimg.com/media/Fi6QYnVXEBsm3jQ.png,False,51,5,2,,None,,,,,,,[],,,,
98,1598370850209558528,1598370850209558528,1669916281000.0,2022-12-01 23:08:01,+0530,,Issue for equities now is valuation 18 X $225 = 4050. Becomes harder to push higher above there.,en,[],[],1444376487457603587,1444376487457603587,NorthRockLP,Hal Press,4,23,https://twitter.com/NorthRockLP/status/1598370850209558528,[],[],0,,False,35,2,0,,None,,,,,,,[],,,,
99,1598136987877531648,1598136987877531648,1669860524000.0,2022-12-01 07:38:44,+0530,,This is a wild and clearly uninformed take.,en,[],[],1444376487457603587,1444376487457603587,NorthRockLP,Hal Press,4,07,https://twitter.com/NorthRockLP/status/1598136987877531648,[],[],0,,False,138,15,1,https://twitter.com/BillAckman/status/1598086237969338368,None,,,,,,,[],,,,
100,1598121402691121152,1598070099386462208,1669856808000.0,2022-12-01 06:36:48,+0530,,@AndJBud I think will prolly work out ok but there is uncertainty. Cleaner to just buy BTC or ETH.,en,[],[],1444376487457603587,1444376487457603587,NorthRockLP,Hal Press,4,06,https://twitter.com/NorthRockLP/status/1598121402691121152,[],[],0,,False,12,0,1,,None,,,,,,,"[{'screen_name': 'AndJBud', 'name': 'ButYouWereAMT', 'id': '916105162489581568'}]",,,,
101,1598096504505651202,1598096504505651202,1669850872000.0,2022-12-01 04:57:52,+0530,,This looks like a bottom in SOLETH. I expect SOL to be one of the most sold tokens through year end with fund redemptions but after that good chance it's also one of the tokens that snaps back the hardest.  https://t.co/GdlyUcFUkt,en,[],[],1444376487457603587,1444376487457603587,NorthRockLP,Hal Press,4,04,https://twitter.com/NorthRockLP/status/1598096504505651202,[],['https://pbs.twimg.com/media/Fi2T_9gUoAAsxPn.png'],1,https://pbs.twimg.com/media/Fi2T_9gUoAAsxPn.png,False,145,22,8,,None,,,,,,,[],,,,
102,1598092588997042176,1598070099386462208,1669849938000.0,2022-12-01 04:42:18,+0530,,"@playflcollector Ofc there are edge cases. Fed funds at 7 would be one of those that would make me reevaluate, that's extremely unlikely though. Corp earnings down 15 is not far off the base case though, think that's pretty much priced already.",en,[],[],1444376487457603587,1444376487457603587,NorthRockLP,Hal Press,4,04,https://twitter.com/NorthRockLP/status/1598092588997042176,[],[],0,,False,0,1,0,,None,,,,,,,"[{'screen_name': 'playflcollector', 'name': 'playflcollector 🦇🔊', 'id': '1288430656482086912'}]",,,,
103,1598085871756279809,1598070099386462208,1669848337000.0,2022-12-01 04:15:37,+0530,,@playflcollector Credible risk to Binance or Tether. Not much else.,en,[],[],1444376487457603587,1444376487457603587,NorthRockLP,Hal Press,4,04,https://twitter.com/NorthRockLP/status/1598085871756279809,[],[],0,,False,3,1,0,,None,,,,,,,"[{'screen_name': 'playflcollector', 'name': 'playflcollector 🦇🔊', 'id': '1288430656482086912'}]",,,,
104,1598072485630857216,1598072471626084353,1669845145000.0,2022-12-01 03:22:25,+0530,,"This means that so long as you don't have sellers the natural direction is up. This is why, to me, seller exhaustion is largely sufficient for ETH price uptrend despite low activity. Of course there are limits, but from these levels I am comfortable betting it is enough.",en,[],[],1444376487457603587,1444376487457603587,NorthRockLP,Hal Press,4,03,https://twitter.com/NorthRockLP/status/1598072485630857216,[],[],0,,False,30,1,0,,None,,,,,,,[],,,,
105,1598072482329919490,1598072471626084353,1669845145000.0,2022-12-01 03:22:25,+0530,,"Furthermore, unlike with PoW they don't have nearly any expenses and therefore very little cost to cover with token sales. So while the level of fees matter because this dictates *how much* buy pressure there is, there is at least always some buy pressure.",en,[],[],1444376487457603587,1444376487457603587,NorthRockLP,Hal Press,4,03,https://twitter.com/NorthRockLP/status/1598072482329919490,[],[],0,,False,16,1,0,,None,,,,,,,[],,,,
106,1598072479050010625,1598072471626084353,1669845144000.0,2022-12-01 03:22:24,+0530,,"The reason for this is that the ""inflation"" (ie token emission) is not sold. Even after withdrawals it still wont be sold. Stakers *want* more ETH so generally they don't sell their rewards.",en,[],[],1444376487457603587,1444376487457603587,NorthRockLP,Hal Press,4,03,https://twitter.com/NorthRockLP/status/1598072479050010625,[],[],0,,False,11,2,0,,None,,,,,,,[],,,,
107,1598072475488641024,1598072471626084353,1669845143000.0,2022-12-01 03:22:23,+0530,,"The reason for this is that activity is not needed to create structural buy pressure. The more activity there is the larger the buy pressure is but, post-merge, no matter what there is at least some buy pressure.",en,[],[],1444376487457603587,1444376487457603587,NorthRockLP,Hal Press,4,03,https://twitter.com/NorthRockLP/status/1598072475488641024,[],[],0,,False,11,1,0,,None,,,,,,,[],,,,
