,id,conversation_id,created_at,date,timezone,place,tweet,language,hashtags,cashtags,user_id,user_id_str,username,name,day,hour,link,urls,photos,video,thumbnail,retweet,nlikes,nreplies,nretweets,quote_url,search,near,geo,source,user_rt_id,user_rt,retweet_id,reply_to,retweet_date,translate,trans_src,trans_dest
108,1598072471626084353,1598072471626084353,1669845142000.0,2022-12-01 03:22:22,+0530,,"Despite my bullishness on price I am also simultaneous bearish on activity in the near term. I think it will take a minimum of months for any real activity to come back but this doesn't change my bullish view on price, specifically for ETH.",en,[],[],1444376487457603587,1444376487457603587,NorthRockLP,Hal Press,4,03,https://twitter.com/NorthRockLP/status/1598072471626084353,[],[],0,,False,68,4,3,https://twitter.com/NorthRockLP/status/1597738251632381952,None,,,,,,,[],,,,
109,1598070139391733760,1598070099386462208,1669844586000.0,2022-12-01 03:13:06,+0530,,"All there is to do now is continue accumulating through the end of the year and then wait. I have confidence that after that, a spark will eventually emerge to light the dry grass that has been growing. Good luck friends, happy accumulating.",en,[],[],1444376487457603587,1444376487457603587,NorthRockLP,Hal Press,4,03,https://twitter.com/NorthRockLP/status/1598070139391733760,[],[],0,,False,116,4,5,,None,,,,,,,[],,,,
110,1598070136988401665,1598070099386462208,1669844586000.0,2022-12-01 03:13:06,+0530,,"So to conclude, once we get to the new year I believe the set up will be ripe for asymmetric upside and the ongoing macro inflection provides the perfect spark.",en,[],[],1444376487457603587,1444376487457603587,NorthRockLP,Hal Press,4,03,https://twitter.com/NorthRockLP/status/1598070136988401665,[],[],0,,False,54,1,3,,None,,,,,,,[],,,,
111,1598070134413066240,1598070099386462208,1669844585000.0,2022-12-01 03:13:05,+0530,,"Furthermore, while regulation is certainly coming, the FTX situation shows how desperately needed it is (especially on the CEX side) and this is likely to end up being more of a positive than a negative.",en,[],[],1444376487457603587,1444376487457603587,NorthRockLP,Hal Press,4,03,https://twitter.com/NorthRockLP/status/1598070134413066240,[],[],0,,False,44,2,2,,None,,,,,,,[],,,,
112,1598070132001374211,1598070099386462208,1669844584000.0,2022-12-01 03:13:04,+0530,,"However, once price starts going up I believe there will also be a positive narrative that will emerge. This narrative will likely revolve around the fact that after FTX the industry is further battle hardened and the remaining entities should be more durable going forward.",en,[],[],1444376487457603587,1444376487457603587,NorthRockLP,Hal Press,4,03,https://twitter.com/NorthRockLP/status/1598070132001374211,[],[],0,,False,46,1,2,,None,,,,,,,[],,,,
113,1598070129505361946,1598070099386462208,1669844584000.0,2022-12-01 03:13:04,+0530,,"So, as investors look forward there is a question about what has changed since then. Certainly there are negatives, which rightly attract a lot of focus such as the $10B hole created by FTX, all the users being zero'd and leaving, trust decaying and regulation coming.",en,[],[],1444376487457603587,1444376487457603587,NorthRockLP,Hal Press,4,03,https://twitter.com/NorthRockLP/status/1598070129505361946,[],[],0,,False,38,1,2,,None,,,,,,,[],,,,
114,1598070127001411586,1598070099386462208,1669844583000.0,2022-12-01 03:13:03,+0530,,On to the narrative part of the thesis. Before the FTX collapse crypto was performing very well on a relative basis with ETH at ~$1600 and on-chain activity picking up. Notably this was *before* the broad based macro inflection triggered by the Oct CPI.,en,[],[],1444376487457603587,1444376487457603587,NorthRockLP,Hal Press,4,03,https://twitter.com/NorthRockLP/status/1598070127001411586,[],[],0,,False,41,1,2,,None,,,,,,,[],,,,
115,1598070124569063424,1598070099386462208,1669844583000.0,2022-12-01 03:13:03,+0530,,"Participants need to make enough money to start speculating on chain again and if this happens it creates the self fulfilling positive feedback loop that will be required to fuel a more prolonged uptrend. Nonetheless, we will cross that bridge when we get there.",en,[],[],1444376487457603587,1444376487457603587,NorthRockLP,Hal Press,4,03,https://twitter.com/NorthRockLP/status/1598070124569063424,[],[],0,,False,58,1,4,,None,,,,,,,[],,,,
116,1598070122115399680,1598070099386462208,1669844582000.0,2022-12-01 03:13:02,+0530,,This creates the potential for continuation following the initial breakout. After this is where things get harder to try to forecast. The big question from here will be if and when the rally has gone far enough to stimulate some renewed on-chain activity.,en,[],[],1444376487457603587,1444376487457603587,NorthRockLP,Hal Press,4,03,https://twitter.com/NorthRockLP/status/1598070122115399680,[],[],0,,False,40,3,3,,None,,,,,,,[],,,,
117,1598070119632027650,1598070099386462208,1669844581000.0,2022-12-01 03:13:01,+0530,,"The natural second order effect of this will be FOMO. If there is one thing crypto is good at, it is creating FOMO, and given all the tourists will have just zero'd their exposure the space will be ripe for FOMO.",en,[],[],1444376487457603587,1444376487457603587,NorthRockLP,Hal Press,4,03,https://twitter.com/NorthRockLP/status/1598070119632027650,[],[],0,,False,62,1,2,,None,,,,,,,[],,,,
118,1598070117031518208,1598070099386462208,1669844581000.0,2022-12-01 03:13:01,+0530,,"This creates a clear set up for the start of '23 where you should have supply demand imbalance in the direction of too much demand. This should give rise to a renewed uptrend out of the lows, which will likely be sparked by some macro data point as macro continues to inflect.",en,[],[],1444376487457603587,1444376487457603587,NorthRockLP,Hal Press,4,03,https://twitter.com/NorthRockLP/status/1598070117031518208,[],[],0,,False,51,2,2,,None,,,,,,,[],,,,
119,1598070114523713537,1598070099386462208,1669844580000.0,2022-12-01 03:13:00,+0530,,"Also, at current levels there is data, and plenty of anecdotes, to support the view that there is a large, devoted and liquid group of crypto native HODL'ers who will continue to DCA indefinitely at these levels.",en,[],[],1444376487457603587,1444376487457603587,NorthRockLP,Hal Press,4,03,https://twitter.com/NorthRockLP/status/1598070114523713537,[],[],0,,False,75,3,4,,None,,,,,,,[],,,,
120,1598070112095178752,1598070099386462208,1669844580000.0,2022-12-01 03:13:00,+0530,,Once we enter the new year I am high conviction we will have reached seller exhaustion. I cannot think of a time where the holder base will be made up of more strong handed participants and everyone that could possibly have wanted to sell will likely have sold.,en,[],[],1444376487457603587,1444376487457603587,NorthRockLP,Hal Press,4,03,https://twitter.com/NorthRockLP/status/1598070112095178752,[],[],0,,False,79,2,6,,None,,,,,,,[],,,,
121,1598070109636943874,1598070099386462208,1669844579000.0,2022-12-01 03:12:59,+0530,,So when will the selling end? My operating thesis has been year end. A lot of things coincide with this date most notably annual fund redemptions and FTX digestion.,en,[],[],1444376487457603587,1444376487457603587,NorthRockLP,Hal Press,4,03,https://twitter.com/NorthRockLP/status/1598070109636943874,[],[],0,,False,59,2,3,,None,,,,,,,[],,,,
122,1598070106726146048,1598070099386462208,1669844578000.0,2022-12-01 03:12:58,+0530,,"Almost all did, and that is why we are at these levels. However, those that remain are die-hards. The holder base is as strong as it has ever been and that means that once the selling ends the pump will be primed.",en,[],[],1444376487457603587,1444376487457603587,NorthRockLP,Hal Press,4,03,https://twitter.com/NorthRockLP/status/1598070106726146048,[],[],0,,False,79,2,2,,None,,,,,,,[],,,,
123,1598070104318935040,1598070099386462208,1669844578000.0,2022-12-01 03:12:58,+0530,,2022 has been as bad a year for crypto as one could possibly imagine. Massive negative macro inflection paired with multiple mass scale foundational systematic collapses.  Participants had every chance in the world to sell their exposure and give up on the space.,en,[],[],1444376487457603587,1444376487457603587,NorthRockLP,Hal Press,4,03,https://twitter.com/NorthRockLP/status/1598070104318935040,[],[],0,,False,64,1,3,,None,,,,,,,[],,,,
124,1598070101806583808,1598070099386462208,1669844577000.0,2022-12-01 03:12:57,+0530,,There are two prongs to the thesis. The first revolves around flows and the second is about narrative. Will start with flows. The core of the flows thesis is complete and utter seller exhaustion.,en,[],[],1444376487457603587,1444376487457603587,NorthRockLP,Hal Press,4,03,https://twitter.com/NorthRockLP/status/1598070101806583808,[],[],0,,False,72,2,3,,None,,,,,,,[],,,,
125,1598070099386462208,1598070099386462208,1669844577000.0,2022-12-01 03:12:57,+0530,,"Ok, so I've been vocally bullish since FTX collapse, why? What is the thesis from here? Isn't crypto fk'd? Time for a long 🧵",en,[],[],1444376487457603587,1444376487457603587,NorthRockLP,Hal Press,4,03,https://twitter.com/NorthRockLP/status/1598070099386462208,[],[],0,,False,517,27,82,,None,,,,,,,[],,,,
126,1598059556256374784,1598059556256374784,1669842063000.0,2022-12-01 02:31:03,+0530,,Nothing makes me more bullish than the fact that people who have been bearish for the last 3 weeks while I accumulated into their shorts still think I am an idiot.,en,[],[],1444376487457603587,1444376487457603587,NorthRockLP,Hal Press,4,02,https://twitter.com/NorthRockLP/status/1598059556256374784,[],[],0,,False,139,9,8,,None,,,,,,,[],,,,
127,1598059083588075520,1592213997205454855,1669841950000.0,2022-12-01 02:29:10,+0530,,@crypto_dolfin  https://t.co/oyAaYP5dAR,qme,[],[],1444376487457603587,1444376487457603587,NorthRockLP,Hal Press,4,02,https://twitter.com/NorthRockLP/status/1598059083588075520,['https://twitter.com/NorthRockLP/status/1598003624365674498?s=20&t=M26VT5EOMixaeuRIjmSJwg'],[],0,,False,0,1,0,https://twitter.com/NorthRockLP/status/1598003624365674498?s=20&t=M26VT5EOMixaeuRIjmSJwg,None,,,,,,,"[{'screen_name': 'crypto_dolfin', 'name': 'CryptoDolphin |', 'id': '295755451'}]",,,,
128,1598058006624681984,1598058006624681984,1669841693000.0,2022-12-01 02:24:53,+0530,,Posted this at $1080 ETH. Turns out that was indeed the capitulation bottom.,en,[],[],1444376487457603587,1444376487457603587,NorthRockLP,Hal Press,4,02,https://twitter.com/NorthRockLP/status/1598058006624681984,[],[],0,,False,78,6,2,https://twitter.com/NorthRockLP/status/1594780647343939584,None,,,,,,,[],,,,
129,1598051599225524225,1598051599225524225,1669840166000.0,2022-12-01 01:59:26,+0530,,"As equities breakout to the upside, the question below remains the key question.",en,[],[],1444376487457603587,1444376487457603587,NorthRockLP,Hal Press,4,01,https://twitter.com/NorthRockLP/status/1598051599225524225,[],[],0,,False,28,0,1,https://twitter.com/NorthRockLP/status/1592213997205454855,None,,,,,,,[],,,,
130,1598051216759656452,1598051216759656452,1669840075000.0,2022-12-01 01:57:55,+0530,,"After digging into the data, I tend to agree. And if this is true, v likely not much further contagion to come.",en,[],[],1444376487457603587,1444376487457603587,NorthRockLP,Hal Press,4,01,https://twitter.com/NorthRockLP/status/1598051216759656452,[],[],0,,False,69,4,5,https://twitter.com/twobitidiot/status/1598020947558424577,None,,,,,,,[],,,,
131,1598033124054958080,1598033124054958080,1669835761000.0,2022-12-01 00:46:01,+0530,,The bear porn and absolutely mindless bear takes have gotten more extreme than I have ever seen before. Do with that info what you please.,en,[],[],1444376487457603587,1444376487457603587,NorthRockLP,Hal Press,4,00,https://twitter.com/NorthRockLP/status/1598033124054958080,[],[],0,,False,159,10,14,,None,,,,,,,[],,,,
132,1598031442990465024,1598031442990465024,1669835360000.0,2022-12-01 00:39:20,+0530,,"LMAO, this is the new bear narrative? 😂",en,[],[],1444376487457603587,1444376487457603587,NorthRockLP,Hal Press,4,00,https://twitter.com/NorthRockLP/status/1598031442990465024,[],[],0,,False,34,3,0,https://twitter.com/zedbanana8/status/1598030814520168448,None,,,,,,,[],,,,
133,1598028915712307200,1598028915712307200,1669834758000.0,2022-12-01 00:29:18,+0530,,FED not even pretending data isn't going in the right direction any longer. If you can't tell pivot is coming you are blinded by bias.,en,[],[],1444376487457603587,1444376487457603587,NorthRockLP,Hal Press,4,00,https://twitter.com/NorthRockLP/status/1598028915712307200,[],[],0,,False,60,8,6,https://twitter.com/NorthRockLP/status/1597997434298257410,None,,,,,,,[],,,,
134,1598026885308461056,1598026885308461056,1669834274000.0,2022-12-01 00:21:14,+0530,,Powell now making this exact point. 🤔,en,[],[],1444376487457603587,1444376487457603587,NorthRockLP,Hal Press,4,00,https://twitter.com/NorthRockLP/status/1598026885308461056,[],[],0,,False,26,0,1,https://twitter.com/NorthRockLP/status/1588270816084361216,None,,,,,,,[],,,,
135,1598020152960118785,1597997434298257410,1669832668000.0,2022-11-30 23:54:28,+0530,,@Evan_ss6 gentlemen's bet will have to suffice,en,[],[],1444376487457603587,1444376487457603587,NorthRockLP,Hal Press,3,23,https://twitter.com/NorthRockLP/status/1598020152960118785,[],[],0,,False,2,1,0,,None,,,,,,,"[{'screen_name': 'Evan_ss6', 'name': 'Evanss6.eth', 'id': '279828819'}]",,,,
136,1598019663384186880,1598002675768954880,1669832552000.0,2022-11-30 23:52:32,+0530,,"@davidpco Ser, i have consistently maintained that CPI would peak with a specific emphasis on the prior print....",en,[],[],1444376487457603587,1444376487457603587,NorthRockLP,Hal Press,3,23,https://twitter.com/NorthRockLP/status/1598019663384186880,[],[],0,,False,3,1,0,,None,,,,,,,"[{'screen_name': 'davidpco', 'name': 'David Phillips', 'id': '884476792907497473'}]",,,,
137,1598014829368774656,1597997434298257410,1669831399000.0,2022-11-30 23:33:19,+0530,,@Evan_ss6 Even,en,[],[],1444376487457603587,1444376487457603587,NorthRockLP,Hal Press,3,23,https://twitter.com/NorthRockLP/status/1598014829368774656,[],[],0,,False,1,1,0,,None,,,,,,,"[{'screen_name': 'Evan_ss6', 'name': 'Evanss6.eth', 'id': '279828819'}]",,,,
138,1598014504285048834,1597997434298257410,1669831322000.0,2022-11-30 23:32:02,+0530,,@Evan_ss6 New bet. I'll bet we don't see triple digit ETH or QQQ 10% lower than here.,en,[],[],1444376487457603587,1444376487457603587,NorthRockLP,Hal Press,3,23,https://twitter.com/NorthRockLP/status/1598014504285048834,[],[],0,,False,3,2,0,,None,,,,,,,"[{'screen_name': 'Evan_ss6', 'name': 'Evanss6.eth', 'id': '279828819'}]",,,,
139,1598012581288951808,1597997434298257410,1669830863000.0,2022-11-30 23:24:23,+0530,,"@Evan_ss6 How about this, I'll make u a bet ETH and QQQ are higher in 12 months?",en,[],[],1444376487457603587,1444376487457603587,NorthRockLP,Hal Press,3,23,https://twitter.com/NorthRockLP/status/1598012581288951808,[],[],0,,False,2,1,0,,None,,,,,,,"[{'screen_name': 'Evan_ss6', 'name': 'Evanss6.eth', 'id': '279828819'}]",,,,
140,1598011443806318593,1597997434298257410,1669830592000.0,2022-11-30 23:19:52,+0530,,"@Evan_ss6 ser if you go by this logic then you can never buy anything cuz there will always be some drawdown in future. IMO, its best to look ~3 months ahead and constantly refresh",en,[],[],1444376487457603587,1444376487457603587,NorthRockLP,Hal Press,3,23,https://twitter.com/NorthRockLP/status/1598011443806318593,[],[],0,,False,1,2,0,,None,,,,,,,"[{'screen_name': 'Evan_ss6', 'name': 'Evanss6.eth', 'id': '279828819'}]",,,,
141,1598010469427851264,1597997434298257410,1669830360000.0,2022-11-30 23:16:00,+0530,,"@StephenCesaro @Evan_ss6 ser, i think you misunderstand why fed does what it does, time will tell though",en,[],[],1444376487457603587,1444376487457603587,NorthRockLP,Hal Press,3,23,https://twitter.com/NorthRockLP/status/1598010469427851264,[],[],0,,False,3,0,0,,None,,,,,,,"[{'screen_name': 'StephenCesaro', 'name': 'STΞPHΞN 🌾', 'id': '994030034'}, {'screen_name': 'Evan_ss6', 'name': 'Evanss6.eth', 'id': '279828819'}]",,,,
142,1598009646799024129,1597997434298257410,1669830164000.0,2022-11-30 23:12:44,+0530,,@zjtate91 pause,en,[],[],1444376487457603587,1444376487457603587,NorthRockLP,Hal Press,3,23,https://twitter.com/NorthRockLP/status/1598009646799024129,[],[],0,,False,13,2,1,,None,,,,,,,"[{'screen_name': 'zjtate91', 'name': 'Zac Tate', 'id': '591053151'}]",,,,
143,1598007540553437185,1597997434298257410,1669829661000.0,2022-11-30 23:04:21,+0530,,"@SLadington agree, max long between now and year end",en,[],[],1444376487457603587,1444376487457603587,NorthRockLP,Hal Press,3,23,https://twitter.com/NorthRockLP/status/1598007540553437185,[],[],0,,False,20,2,1,,None,,,,,,,"[{'screen_name': 'SLadington', 'name': 'SirChadington', 'id': '1233329744201973762'}]",,,,
144,1598004662665326592,1597997434298257410,1669828975000.0,2022-11-30 22:52:55,+0530,,"@ZeMirch @Evan_ss6 Correct. This chart shows the varying types of pivot, but that fact doesn't fit the bias so why would we acknowledge it?",en,[],[],1444376487457603587,1444376487457603587,NorthRockLP,Hal Press,3,22,https://twitter.com/NorthRockLP/status/1598004662665326592,[],[],0,,False,0,1,0,,None,,,,,,,"[{'screen_name': 'ZeMirch', 'name': 'Pepper 🔱🌎', 'id': '1406338975946706946'}, {'screen_name': 'Evan_ss6', 'name': 'Evanss6.eth', 'id': '279828819'}]",,,,
145,1598003624365674498,1597997434298257410,1669828728000.0,2022-11-30 22:48:48,+0530,,"@Evan_ss6 Dude come on. This is abt as stupid a chart as I've seen. Look at 2019, fed pivot followed by missive risk on rally but then we just extend period to covid to show a crash. LMAO, obviously markets will eventually go down for some reason again, no sht",en,[],[],1444376487457603587,1444376487457603587,NorthRockLP,Hal Press,3,22,https://twitter.com/NorthRockLP/status/1598003624365674498,[],[],0,,False,12,3,1,,None,,,,,,,"[{'screen_name': 'Evan_ss6', 'name': 'Evanss6.eth', 'id': '279828819'}]",,,,
146,1598003010256637952,1598002675768954880,1669828581000.0,2022-11-30 22:46:21,+0530,,"So you can doom post all the historical analog charts you want, but if they lack context they not relevant.",en,[],[],1444376487457603587,1444376487457603587,NorthRockLP,Hal Press,3,22,https://twitter.com/NorthRockLP/status/1598003010256637952,[],[],0,,False,16,1,0,,None,,,,,,,[],,,,
147,1598002675768954880,1598002675768954880,1669828502000.0,2022-11-30 22:45:02,+0530,,This is an important point and something I think many misunderstand. Not all pivots are created equal. Obviously if FED pivots cuz something blew up assets gonna act differently than if FED pivots cuz inflation came down. The later is what the data suggests is going to happen.,en,[],[],1444376487457603587,1444376487457603587,NorthRockLP,Hal Press,3,22,https://twitter.com/NorthRockLP/status/1598002675768954880,[],[],0,,False,33,2,3,https://twitter.com/NorthRockLP/status/1598002068303712256,None,,,,,,,[],,,,
148,1598002293936619520,1597997434298257410,1669828410000.0,2022-11-30 22:43:30,+0530,,"@scootdart @Evan_ss6 how much higher is not relevent. if they gonna be higher thats all you need to know, can just sell then if u want",en,[],[],1444376487457603587,1444376487457603587,NorthRockLP,Hal Press,3,22,https://twitter.com/NorthRockLP/status/1598002293936619520,[],[],0,,False,0,1,0,,None,,,,,,,"[{'screen_name': 'scootdart', 'name': 'Scootdart', 'id': '1466579833132097539'}, {'screen_name': 'Evan_ss6', 'name': 'Evanss6.eth', 'id': '279828819'}]",,,,
149,1598002068303712256,1597997434298257410,1669828357000.0,2022-11-30 22:42:37,+0530,,"@Evan_ss6 If you look at ""history"" generally what you looking at is occasions where there was some unexpected event that caused the pivot (ie covid) and also created the nuke. If pivot just caused by inflation easing, extremely unlikely to be accompanied by nuke.",en,[],[],1444376487457603587,1444376487457603587,NorthRockLP,Hal Press,3,22,https://twitter.com/NorthRockLP/status/1598002068303712256,[],[],0,,False,12,1,3,,None,,,,,,,"[{'screen_name': 'Evan_ss6', 'name': 'Evanss6.eth', 'id': '279828819'}]",,,,
150,1598001267368157184,1597997434298257410,1669828166000.0,2022-11-30 22:39:26,+0530,,"@Evan_ss6 Exact path, timing and magnitude is uncertain. High confidence all assets will be significantly higher post pivot though and that's enough for me.",en,[],[],1444376487457603587,1444376487457603587,NorthRockLP,Hal Press,3,22,https://twitter.com/NorthRockLP/status/1598001267368157184,[],[],0,,False,7,4,0,,None,,,,,,,"[{'screen_name': 'Evan_ss6', 'name': 'Evanss6.eth', 'id': '279828819'}]",,,,
151,1597999828364972032,1597997434298257410,1669827823000.0,2022-11-30 22:33:43,+0530,,This doesn't mean I expect some big pivot at the next meeting in Dec or even the one after that. My point is different. If you look at the direction the data is heading you can conclude with high certainty FED will pivot at some point in Q1. Exact timing is less relevant to me.,en,[],[],1444376487457603587,1444376487457603587,NorthRockLP,Hal Press,3,22,https://twitter.com/NorthRockLP/status/1597999828364972032,[],[],0,,False,67,6,3,,None,,,,,,,[],,,,
152,1597999058651860993,1597999058651860993,1669827639000.0,2022-11-30 22:30:39,+0530,,BTC maxis embracing ETH. Love to see it.,en,[],[],1444376487457603587,1444376487457603587,NorthRockLP,Hal Press,3,22,https://twitter.com/NorthRockLP/status/1597999058651860993,[],[],0,,False,85,3,6,https://twitter.com/lopp/status/1597969459708194819,None,,,,,,,[],,,,
153,1597997434298257410,1597997434298257410,1669827252000.0,2022-11-30 22:24:12,+0530,,"We in a funny spot with macro right now where things are clearly rolling, FED doesn't want to admit it cuz they don't wanna loosen financial conditions and therefore many still don't believe the pivot is coming. If you use a little foresight though it's pretty obvious it is.",en,[],[],1444376487457603587,1444376487457603587,NorthRockLP,Hal Press,3,22,https://twitter.com/NorthRockLP/status/1597997434298257410,[],[],0,,False,165,19,12,,None,,,,,,,[],,,,
154,1597826633531957248,1597826633531957248,1669786530000.0,2022-11-30 11:05:30,+0530,,Ty for providing the bottom signal we all needed. 🫡,en,[],[],1444376487457603587,1444376487457603587,NorthRockLP,Hal Press,3,11,https://twitter.com/NorthRockLP/status/1597826633531957248,[],[],0,,False,160,7,5,https://twitter.com/CitronResearch/status/1592230868357156865,None,,,,,,,[],,,,
155,1597821569090588672,1597799069618909184,1669785322000.0,2022-11-30 10:45:22,+0530,,"@CokerEth Thanks my friend. Dw though, I don't take any of this sht too seriously.",en,[],[],1444376487457603587,1444376487457603587,NorthRockLP,Hal Press,3,10,https://twitter.com/NorthRockLP/status/1597821569090588672,[],[],0,,False,6,0,0,,None,,,,,,,"[{'screen_name': 'CokerEth', 'name': 'Coker.eth 🪶🛡', 'id': '1532748516765732864'}]",,,,
156,1597818959390453761,1597812531523117056,1669784700000.0,2022-11-30 10:35:00,+0530,,@jb_apes I could see it. More BTC down than BNB up though.,en,[],[],1444376487457603587,1444376487457603587,NorthRockLP,Hal Press,3,10,https://twitter.com/NorthRockLP/status/1597818959390453761,[],[],0,,False,3,5,0,,None,,,,,,,"[{'screen_name': 'jb_apes', 'name': 'JB', 'id': '1204106056231723009'}]",,,,
157,1597812531523117056,1597812531523117056,1669783168000.0,2022-11-30 10:09:28,+0530,,To the BTC maxis who say BNB is a shitcoin. GG.  https://t.co/vLVXtV52mG,en,[],[],1444376487457603587,1444376487457603587,NorthRockLP,Hal Press,3,10,https://twitter.com/NorthRockLP/status/1597812531523117056,[],['https://pbs.twimg.com/media/FiyR-DNXoAciCQ3.png'],1,https://pbs.twimg.com/media/FiyR-DNXoAciCQ3.png,False,86,10,3,https://twitter.com/NorthRockLP/status/1597803551824130049,None,,,,,,,[],,,,
158,1597803551824130049,1597803551824130049,1669781027000.0,2022-11-30 09:33:47,+0530,,Have started buying back some of the BNB now that this has fully unwound. Still like it structurally.,en,[],[],1444376487457603587,1444376487457603587,NorthRockLP,Hal Press,3,09,https://twitter.com/NorthRockLP/status/1597803551824130049,[],[],0,,False,23,4,0,https://twitter.com/NorthRockLP/status/1597796977290665984,None,,,,,,,[],,,,
159,1597799069618909184,1597799069618909184,1669779958000.0,2022-11-30 09:15:58,+0530,,LMFAO. This is what the bears have come too.....  Bullish? 😂,en,[],[],1444376487457603587,1444376487457603587,NorthRockLP,Hal Press,3,09,https://twitter.com/NorthRockLP/status/1597799069618909184,[],[],0,,False,93,14,0,https://twitter.com/Dontgiv21482457/status/1597791607767859200,None,,,,,,,[],,,,
160,1597796977290665984,1597796977290665984,1669779459000.0,2022-11-30 09:07:39,+0530,,Full unwind of launchpad pump  hehe  https://t.co/KigZZM2iBk,en,[],[],1444376487457603587,1444376487457603587,NorthRockLP,Hal Press,3,09,https://twitter.com/NorthRockLP/status/1597796977290665984,[],['https://pbs.twimg.com/media/FiyDxrAXgAQnYcj.png'],1,https://pbs.twimg.com/media/FiyDxrAXgAQnYcj.png,False,16,2,0,https://twitter.com/NorthRockLP/status/1597639544756916225,None,,,,,,,[],,,,
161,1597785674660614146,1597785674660614146,1669776764000.0,2022-11-30 08:22:44,+0530,,Everyone in disbelief of this bounce off the lows. Just wait till ‘23. Faces will be melted.,en,[],[],1444376487457603587,1444376487457603587,NorthRockLP,Hal Press,3,08,https://twitter.com/NorthRockLP/status/1597785674660614146,[],[],0,,False,291,28,17,,None,,,,,,,[],,,,
162,1597758726185762816,1597758726185762816,1669770339000.0,2022-11-30 06:35:39,+0530,,Looks like I should’ve been measuring my timeline in hours not weeks 🤣,en,[],[],1444376487457603587,1444376487457603587,NorthRockLP,Hal Press,3,06,https://twitter.com/NorthRockLP/status/1597758726185762816,[],[],0,,False,40,5,1,https://twitter.com/NorthRockLP/status/1597735473232760832,None,,,,,,,[],,,,
